category,api,description,auth,https,cors,link
Games & Comics,Steam,Steam Web API documentation,`apiKey`,Yes,No,https://steamapi.xpaw.me/
Games & Comics,Steam,Internal Steam Web API documentation,No,Yes,No,https://github.com/Revadike/InternalSteamWebAPI/wiki
Games & Comics,SuperHeroes,All SuperHeroes and Villains data from all universes under a single API,`apiKey`,Yes,Unknown,https://superheroapi.com
Games & Comics,TCGdex,Multi languages Pokémon TCG Information,No,Yes,Yes,https://www.tcgdex.net/docs
Games & Comics,Tebex,Tebex API for information about game purchases,`X-Mashape-Key`,Yes,No,https://docs.tebex.io/plugin/
Games & Comics,TETR.IO,TETR.IO Tetra Channel API,No,Yes,Unknown,https://tetr.io/about/api/
Games & Comics,Tronald Dump,The dumbest things Donald Trump has ever said,No,Yes,Unknown,https://www.tronalddump.io/
Games & Comics,Universalis,Final Fantasy XIV market board data,No,Yes,Yes,https://universalis.app/docs/index.html
Games & Comics,Valorant (non-official),"An extensive API containing data of most Valorant in-game items, assets and more",No,Yes,Unknown,https://valorant-api.com
Games & Comics,Warface (non-official),Official API proxy with better data structure and more features,No,Yes,No,https://api.wfstats.cf
Games & Comics,Wargaming.net,Wargaming.net info and stats,`apiKey`,Yes,No,https://developers.wargaming.net/
Games & Comics,When is next MCU film,Upcoming MCU film information,No,Yes,Unknown,https://github.com/DiljotSG/MCU-Countdown/blob/develop/docs/API.md
Games & Comics,xkcd,Retrieve xkcd comics as JSON,No,Yes,No,https://xkcd.com/json.html
Games & Comics,Yu-Gi-Oh!,Yu-Gi-Oh! TCG Information,No,Yes,Unknown,https://db.ygoprodeck.com/api-guide/
Geocoding,Abstract IP Geolocation,Geolocate website visitors from their IPs,`apiKey`,Yes,Yes,https://www.abstractapi.com/ip-geolocation-api
Geocoding,Actinia Grass GIS,Actinia is an open source REST API for geographical data that uses GRASS GIS,`apiKey`,Yes,Unknown,https://actinia.mundialis.de/api_docs/
Geocoding,administrative-divisons-db,Get all administrative divisions of a country,No,Yes,Yes,https://github.com/kamikazechaser/administrative-divisions-db
Geocoding,adresse.data.gouv.fr,"Address database of France, geocoding and reverse",No,Yes,Unknown,https://adresse.data.gouv.fr
Geocoding,Airtel IP,IP Geolocation API. Collecting data from multiple sources,No,Yes,Unknown,https://sys.airtel.lv/ip2country/1.1.1.1/?full=true
Geocoding,Apiip,Get location information by IP address,`apiKey`,Yes,Yes,https://apiip.net/
Geocoding,apilayer ipstack,Locate and identify website visitors by IP address,`apiKey`,Yes,Unknown,https://ipstack.com/
Geocoding,Battuta,A (country/region/city) in-cascade location API,`apiKey`,No,Unknown,http://battuta.medunes.net
Geocoding,BigDataCloud,Provides fast and accurate IP geolocation APIs along with security checks and confidence area,`apiKey`,Yes,Unknown,https://www.bigdatacloud.com/ip-geolocation-apis
Geocoding,Bing Maps,Create/customize digital maps based on Bing Maps data,`apiKey`,Yes,Unknown,https://www.microsoft.com/maps/
Geocoding,bng2latlong,Convert British OSGB36 easting and northing (British National Grid) to WGS84 latitude and longitude,No,Yes,Yes,https://www.getthedata.com/bng2latlong
Geocoding,Cartes.io,Create maps and markers for anything,No,Yes,Unknown,https://github.com/M-Media-Group/Cartes.io/wiki/API
Geocoding,Cep.la,"Brazil RESTful API to find information about streets, zip codes, neighborhoods, cities and states",No,No,Unknown,http://cep.la/
Geocoding,CitySDK,Open APIs for select European cities,No,Yes,Unknown,http://www.citysdk.eu/citysdk-toolkit/
Geocoding,Country,Get your visitor's country from their IP,No,Yes,Yes,http://country.is/
Geocoding,CountryStateCity,"World countries, states, regions, provinces, cities & towns in JSON, SQL, XML, YAML, & CSV format",`apiKey`,Yes,Yes,https://countrystatecity.in/
Geocoding,Ducks Unlimited,API explorer that gives a query URL with a JSON response of locations and cities,No,Yes,No,https://gis.ducks.org/datasets/du-university-chapters/api
Geocoding,GeoApi,French geographical data,No,Yes,Unknown,https://api.gouv.fr/api/geoapi.html
Geocoding,Geoapify,"Forward and reverse geocoding, address autocomplete",`apiKey`,Yes,Yes,https://www.geoapify.com/api/geocoding-api/
Geocoding,Geocod.io,Address geocoding / reverse geocoding in bulk,`apiKey`,Yes,Unknown,https://www.geocod.io/
Geocoding,Geocode.xyz,"Provides worldwide forward/reverse geocoding, batch geocoding and geoparsing",No,Yes,Unknown,https://geocode.xyz/api
Geocoding,Geocodify.com,"Worldwide geocoding, geoparsing and autocomplete for addresses",`apiKey`,Yes,Yes,https://geocodify.com/
Geocoding,Geodata.gov.gr,Open geospatial data and API service for Greece,No,Yes,Unknown,https://geodata.gov.gr/en/
Geocoding,GeoDataSource,Geocoding of city name by using latitude and longitude coordinates,`apiKey`,Yes,Unknown,https://www.geodatasource.com/web-service
Geocoding,GeoDB Cities,"Get global city, region, and country data",`apiKey`,Yes,Unknown,http://geodb-cities-api.wirefreethought.com/
Geocoding,GeographQL,"A Country, State, and City GraphQL API",No,Yes,Yes,https://geographql.netlify.app
Geocoding,GeoJS,IP geolocation with ChatOps integration,No,Yes,Yes,https://www.geojs.io/
Geocoding,Geokeo,Geokeo geocoding service- with 2500 free api requests daily,No,Yes,Yes,https://geokeo.com
Geocoding,GeoNames,Place names and other geographical data,No,No,Unknown,http://www.geonames.org/export/web-services.html
Geocoding,geoPlugin,IP geolocation and currency conversion,No,Yes,Yes,https://www.geoplugin.com
Geocoding,Google Earth Engine,A cloud-based platform for planetary-scale environmental data analysis,`apiKey`,Yes,Unknown,https://developers.google.com/earth-engine/
Geocoding,Google Maps,Create/customize digital maps based on Google Maps data,`apiKey`,Yes,Unknown,https://developers.google.com/maps/
Geocoding,Graph Countries,"Country-related data like currencies, languages, flags, regions+subregions and bordering countries",No,Yes,Unknown,https://github.com/lennertVanSever/graphcountries
Geocoding,HelloSalut,Get hello translation following user language,No,Yes,Unknown,https://fourtonfish.com/project/hellosalut-api/
Geocoding,HERE Maps,Create/customize digital maps based on HERE Maps data,`apiKey`,Yes,Unknown,https://developer.here.com
Geocoding,Hirak IP to Country,"Ip to location with country code, currency code & currency name, fast response, unlimited requests",`apiKey`,Yes,Unknown,https://iplocation.hirak.site/
Geocoding,Hong Kong GeoData Store,API for accessing geo-data of Hong Kong,No,Yes,Unknown,https://geodata.gov.hk/gs/
Geocoding,IBGE,Aggregate services of IBGE (Brazilian Institute of Geography and Statistics),No,Yes,Unknown,https://servicodados.ibge.gov.br/api/docs/
Geocoding,IP 2 Country,Map an IP to a country,No,Yes,Unknown,https://ip2country.info
Geocoding,IP Address Details,Find geolocation with ip address,No,Yes,Unknown,https://ipinfo.io/
Geocoding,IP Vigilante,Free IP Geolocation API,No,Yes,Unknown,https://www.ipvigilante.com/
Geocoding,ip-api,Find location with IP address or domain,No,No,Unknown,https://ip-api.com/docs
Geocoding,IP2Location,IP geolocation web service to get more than 55 parameters,`apiKey`,Yes,Unknown,https://www.ip2location.com/web-service/ip2location
Geocoding,IP2Proxy,Detect proxy and VPN using IP address,`apiKey`,Yes,Unknown,https://www.ip2location.com/web-service/ip2proxy
Geocoding,ipapi.co,Find IP address location information,No,Yes,Yes,https://ipapi.co/api/#introduction
Geocoding,ipapi.com,Real-time Geolocation & Reverse IP Lookup REST API,`apiKey`,Yes,Unknown,https://ipapi.com/
Geocoding,IPGEO,Unlimited free IP Address API with useful information,No,Yes,Unknown,https://api.techniknews.net/ipgeo/
Geocoding,ipgeolocation,IP Geolocation AP with free plan 30k requests per month,`apiKey`,Yes,Yes,https://ipgeolocation.io/
Geocoding,IPInfoDB,"Free Geolocation tools and APIs for country, region, city and time zone lookup by IP address",`apiKey`,Yes,Unknown,https://www.ipinfodb.com/api
Geocoding,ipstack,Locate and identify website visitors by IP address,`apiKey`,Yes,Unknown,https://ipstack.com/
Geocoding,Kakao Maps,Kakao Maps provide multiple APIs for Korean maps,`apiKey`,Yes,Unknown,https://apis.map.kakao.com
Geocoding,keycdn IP Location Finder,Get the IP geolocation data through the simple REST API. All the responses are JSON encoded,`apiKey`,Yes,Unknown,https://tools.keycdn.com/geo
Geocoding,LocationIQ,Provides forward/reverse geocoding and batch geocoding,`apiKey`,Yes,Yes,https://locationiq.org/docs/
Geocoding,Longdo Map,Interactive map with detailed places and information portal in Thailand,`apiKey`,Yes,Yes,https://map.longdo.com/docs/
Geocoding,Mapbox,Create/customize beautiful digital maps,`apiKey`,Yes,Unknown,https://docs.mapbox.com/
Geocoding,MapQuest,To access tools and resources to map the world,`apiKey`,Yes,No,https://developer.mapquest.com/
Geocoding,Mexico,Mexico RESTful zip codes API,No,Yes,Unknown,https://github.com/IcaliaLabs/sepomex
Geocoding,Nominatim,Provides worldwide forward / reverse geocoding,No,Yes,Yes,https://nominatim.org/release-docs/latest/api/Overview/
Geocoding,"One Map, Singapore",Singapore Land Authority REST API services for Singapore addresses,`apiKey`,Yes,Unknown,https://www.onemap.gov.sg/docs/
Geocoding,OnWater,Determine if a lat/lon is on water or land,No,Yes,Unknown,https://onwater.io/
Geocoding,Open Topo Data,Elevation and ocean depth for a latitude and longitude,No,Yes,No,https://www.opentopodata.org
Geocoding,OpenCage,Forward and reverse geocoding using open data,`apiKey`,Yes,Yes,https://opencagedata.com
Geocoding,openrouteservice.org,"Directions, POIs, isochrones, geocoding (+reverse), elevation, and more",`apiKey`,Yes,Unknown,https://openrouteservice.org/
Geocoding,OpenStreetMap,"Navigation, geolocation and geographical data",`OAuth`,No,Unknown,http://wiki.openstreetmap.org/wiki/API
Geocoding,Pinball Map,A crowdsourced map of public pinball machines,No,Yes,Yes,https://pinballmap.com/api/v1/docs
Geocoding,positionstack,Forward & Reverse Batch Geocoding REST API,`apiKey`,Yes,Unknown,https://positionstack.com/
Geocoding,Postali,Mexico Zip Codes API,No,Yes,Yes,https://postali.app/api
Geocoding,PostcodeData.nl,Provide geolocation data based on postcode for Dutch addresses,No,No,Unknown,http://api.postcodedata.nl/v1/postcode/?postcode=1211EP&streetnumber=60&ref=domeinnaam.nl&type=json
Geocoding,Postcodes.io,Postcode lookup & Geolocation for the UK,No,Yes,Yes,https://postcodes.io
Geocoding,Queimadas INPE,Access to heat focus data (probable wildfire),No,Yes,Unknown,https://queimadas.dgi.inpe.br/queimadas/dados-abertos/
Geocoding,REST Countries,Get information about countries via a RESTful API,No,Yes,Yes,https://restcountries.com
Geocoding,RoadGoat Cities,Cities content & photos API,`apiKey`,Yes,No,https://www.roadgoat.com/business/cities-api
Geocoding,Rwanda Locations,"Rwanda Provences, Districts, Cities, Capital City, Sector, cells, villages and streets",No,Yes,Unknown,https://rapidapi.com/victorkarangwa4/api/rwanda
Geocoding,SLF,"German city, country, river, database",No,Yes,Yes,https://github.com/slftool/slftool.github.io/blob/master/API.md
Geocoding,SpotSense,Add location based interactions to your mobile app,`apiKey`,Yes,Unknown,https://spotsense.io/
Geocoding,Telize,Telize offers location information from any IP address,`apiKey`,Yes,Yes,https://rapidapi.com/fcambus/api/telize/
Geocoding,TomTom,"Maps, Directions, Places and Traffic APIs",`apiKey`,Yes,Yes,https://developer.tomtom.com/
Geocoding,Uebermaps,Discover and share maps with friends,`apiKey`,Yes,Unknown,https://uebermaps.com/api/v2
Geocoding,US ZipCode,Validate and append data for any US ZipCode,`apiKey`,Yes,Yes,https://www.smarty.com/docs/cloud/us-zipcode-api
Geocoding,Utah AGRC,Utah Web API for geocoding Utah addresses,`apiKey`,Yes,Unknown,https://api.mapserv.utah.gov
Geocoding,ViaCep,Brazil RESTful zip codes API,No,Yes,Unknown,https://viacep.com.br
Geocoding,What3Words,Three words as rememberable and unique coordinates worldwide,`apiKey`,Yes,Unknown,https://what3words.com
Geocoding,Yandex.Maps Geocoder,Use geocoding to get an object's coordinates from its address,`apiKey`,Yes,Unknown,https://yandex.com/dev/maps/geocoder
Geocoding,ZipCodeAPI,"US zip code distance, radius and location API",`apiKey`,Yes,Unknown,https://www.zipcodeapi.com
Geocoding,Zippopotam.us,"Get information about place such as country, city, state, etc",No,No,Unknown,http://www.zippopotam.us
Geocoding,Ziptastic,"Get the country, state, and city of any US zip-code",No,Yes,Unknown,https://ziptasticapi.com/
Government,Bank Negara Malaysia Open Data,Malaysia Central Bank Open Data,No,Yes,Unknown,https://apikijangportal.bnm.gov.my/
Government,BCLaws,Access to the laws of British Columbia,No,No,Unknown,https://www.bclaws.gov.bc.ca/civix/template/complete/api/index.html
Government,Brazil,Community driven API for Brazil Public Data,No,Yes,Yes,https://brasilapi.com.br/
Government,Brazil Central Bank Open Data,Brazil Central Bank Open Data,No,Yes,Unknown,https://dadosabertos.bcb.gov.br/
Government,Brazil Receita WS,Consult companies by CNPJ for Brazilian companies,No,Yes,Unknown,https://www.receitaws.com.br/
Government,Brazilian Chamber of Deputies Open Data,"Provides legislative information in Apis XML and JSON, as well as files in various formats",No,Yes,No,https://dadosabertos.camara.leg.br/swagger/api.html
Government,Census.gov,The US Census Bureau provides various APIs and data sets on demographics and businesses,No,Yes,Unknown,https://www.census.gov/data/developers/data-sets.html
Government,"City, Berlin",Berlin(DE) City Open Data,No,Yes,Unknown,https://daten.berlin.de/
Government,"City, Gdańsk",Gdańsk (PL) City Open Data,No,Yes,Unknown,https://ckan.multimediagdansk.pl/en
Government,"City, Gdynia",Gdynia (PL) City Open Data,No,No,Unknown,http://otwartedane.gdynia.pl/en/api_doc.html
Government,"City, Helsinki",Helsinki(FI) City Open Data,No,Yes,Unknown,https://hri.fi/en_gb/
Government,"City, Lviv",Lviv(UA) City Open Data,No,Yes,Unknown,https://opendata.city-adm.lviv.ua/
Government,"City, Nantes Open Data",Nantes(FR) City Open Data,`apiKey`,Yes,Unknown,https://data.nantesmetropole.fr/pages/home/
Government,"City, New York Open Data",New York (US) City Open Data,No,Yes,Unknown,https://opendata.cityofnewyork.us/
Government,"City, Prague Open Data",Prague(CZ) City Open Data,No,No,Unknown,http://opendata.praha.eu/en
Government,"City, Toronto Open Data",Toronto (CA) City Open Data,No,Yes,Yes,https://open.toronto.ca/
Government,Code.gov,The primary platform for Open Source and code sharing for the U.S. Federal Government,`apiKey`,Yes,Unknown,https://code.gov
Government,Colorado Information Marketplace,Colorado State Government Open Data,No,Yes,Unknown,https://data.colorado.gov/
Government,Data USA,US Public Data,No,Yes,Unknown,https://datausa.io/about/api/
Government,Data.gov,US Government Data,`apiKey`,Yes,Unknown,https://api.data.gov/
Government,Data.parliament.uk,"Contains live datasets including information about petitions, bills, MP votes, attendance and more",No,No,Unknown,https://explore.data.parliament.uk/?learnmore=Members
Government,Deutscher Bundestag DIP,"This API provides read access to DIP entities (e.g. activities, persons, printed material)",`apiKey`,Yes,Unknown,https://dip.bundestag.de/documents/informationsblatt_zur_dip_api_v01.pdf
Government,District of Columbia Open Data,"Contains D.C. government public datasets, including crime, GIS, financial data, and so on",No,Yes,Unknown,http://opendata.dc.gov/pages/using-apis
Government,EPA,Web services and data sets from the US Environmental Protection Agency,No,Yes,Unknown,https://www.epa.gov/developers/data-data-products#apis
Government,FBI Wanted,Access information on the FBI Wanted program,No,Yes,Unknown,https://www.fbi.gov/wanted/api
Government,FEC,Information on campaign donations in federal elections,`apiKey`,Yes,Unknown,https://api.open.fec.gov/developers/
Government,Federal Register,The Daily Journal of the United States Government,No,Yes,Unknown,https://www.federalregister.gov/reader-aids/developer-resources/rest-api
Government,Food Standards Agency,UK food hygiene rating data API,No,No,Unknown,http://ratings.food.gov.uk/open-data/en-GB
Government,"Gazette Data, UK",UK official public record API,`OAuth`,Yes,Unknown,https://www.thegazette.co.uk/data
Government,Gun Policy,International firearm injury prevention and policy,`apiKey`,Yes,Unknown,https://www.gunpolicy.org/api
Government,INEI,Peruvian Statistical Government Open Data,No,No,Unknown,http://iinei.inei.gob.pe/microdatos/
Government,Interpol Red Notices,Access and search Interpol Red Notices,No,Yes,Unknown,https://interpol.api.bund.dev/
Government,Istanbul (İBB) Open Data,Data sets from the İstanbul Metropolitan Municipality (İBB),No,Yes,Unknown,https://data.ibb.gov.tr
Government,"National Park Service, US",Data from the US National Park Service,`apiKey`,Yes,Yes,https://www.nps.gov/subjects/developer/
Government,"Open Government, ACT",Australian Capital Territory Open Data,No,Yes,Unknown,https://www.data.act.gov.au/
Government,"Open Government, Argentina",Argentina Government Open Data,No,Yes,Unknown,https://datos.gob.ar/
Government,"Open Government, Australia",Australian Government Open Data,No,Yes,Unknown,https://www.data.gov.au/
Government,"Open Government, Austria",Austria Government Open Data,No,Yes,Unknown,https://www.data.gv.at/
Government,"Open Government, Belgium",Belgium Government Open Data,No,Yes,Unknown,https://data.gov.be/
Government,"Open Government, Canada",Canadian Government Open Data,No,No,Unknown,http://open.canada.ca/en
Government,"Open Government, Colombia",Colombia Government Open Data,No,No,Unknown,https://www.dane.gov.co/
Government,"Open Government, Cyprus",Cyprus Government Open Data,No,Yes,Unknown,https://data.gov.cy/?language=en
Government,"Open Government, Czech Republic",Czech Republic Government Open Data,No,Yes,Unknown,https://data.gov.cz/english/
Government,"Open Government, Denmark",Denmark Government Open Data,No,Yes,Unknown,https://www.opendata.dk/
Government,"Open Government, Estonia",Estonia Government Open Data,`apiKey`,Yes,Unknown,https://avaandmed.eesti.ee/instructions/opendata-dataset-api
Government,"Open Government, Finland",Finland Government Open Data,No,Yes,Unknown,https://www.avoindata.fi/en
Government,"Open Government, France",French Government Open Data,`apiKey`,Yes,Unknown,https://www.data.gouv.fr/
Government,"Open Government, Germany",Germany Government Open Data,No,Yes,Unknown,https://www.govdata.de/daten/-/details/govdata-metadatenkatalog
Government,"Open Government, Greece",Greece Government Open Data,`OAuth`,Yes,Unknown,https://data.gov.gr/
Government,"Open Government, India",Indian Government Open Data,`apiKey`,Yes,Unknown,https://data.gov.in/
Government,"Open Government, Ireland",Ireland Government Open Data,No,Yes,Unknown,https://data.gov.ie/pages/developers
Government,"Open Government, Italy",Italy Government Open Data,No,Yes,Unknown,https://www.dati.gov.it/
Government,"Open Government, Korea",Korea Government Open Data,`apiKey`,Yes,Unknown,https://www.data.go.kr/
Government,"Open Government, Lithuania",Lithuania Government Open Data,No,Yes,Unknown,https://data.gov.lt/public/api/1
Government,"Open Government, Luxembourg",Luxembourgish Government Open Data,`apiKey`,Yes,Unknown,https://data.public.lu
Government,"Open Government, Mexico",Mexican Statistical Government Open Data,No,Yes,Unknown,https://www.inegi.org.mx/datos/
Government,"Open Government, Mexico",Mexico Government Open Data,No,Yes,Unknown,https://datos.gob.mx/
Government,"Open Government, Netherlands",Netherlands Government Open Data,No,Yes,Unknown,https://data.overheid.nl/en/ondersteuning/data-publiceren/api
Government,"Open Government, New South Wales",New South Wales Government Open Data,`apiKey`,Yes,Unknown,https://api.nsw.gov.au/
Government,"Open Government, New Zealand",New Zealand Government Open Data,No,Yes,Unknown,https://www.data.govt.nz/
Government,"Open Government, Norway",Norwegian Government Open Data,No,Yes,Yes,https://data.norge.no/dataservices
Government,"Open Government, Peru",Peru Government Open Data,No,Yes,Unknown,https://www.datosabiertos.gob.pe/
Government,"Open Government, Poland",Poland Government Open Data,No,Yes,Yes,https://dane.gov.pl/en
Government,"Open Government, Portugal",Portugal Government Open Data,No,Yes,Yes,https://dados.gov.pt/en/docapi/
Government,"Open Government, Queensland Government",Queensland Government Open Data,No,Yes,Unknown,https://www.data.qld.gov.au/
Government,"Open Government, Romania",Romania Government Open Data,No,No,Unknown,http://data.gov.ro/
Government,"Open Government, Saudi Arabia",Saudi Arabia Government Open Data,No,Yes,Unknown,https://data.gov.sa
Government,"Open Government, Singapore",Singapore Government Open Data,No,Yes,Unknown,https://data.gov.sg/developer
Government,"Open Government, Slovakia",Slovakia Government Open Data,No,Yes,Unknown,https://data.gov.sk/en/
Government,"Open Government, Slovenia",Slovenia Government Open Data,No,Yes,No,https://podatki.gov.si/
Government,"Open Government, South Australian Government",South Australian Government Open Data,No,Yes,Unknown,https://data.sa.gov.au/
Government,"Open Government, Spain",Spain Government Open Data,No,Yes,Unknown,https://datos.gob.es/en
Government,"Open Government, Sweden",Sweden Government Open Data,No,Yes,Unknown,https://www.dataportal.se/en/dataservice/91_29789/api-for-the-statistical-database
Government,"Open Government, Switzerland",Switzerland Government Open Data,No,Yes,Unknown,https://handbook.opendata.swiss/de/content/nutzen/api-nutzen.html
Government,"Open Government, Taiwan",Taiwan Government Open Data,No,Yes,Unknown,https://data.gov.tw/
Government,"Open Government, Thailand",Thailand Government Open Data,`apiKey`,Yes,Unknown,https://data.go.th/
Government,"Open Government, UK",UK Government Open Data,No,Yes,Unknown,https://data.gov.uk/
Government,"Open Government, USA",United States Government Open Data,No,Yes,Unknown,https://www.data.gov/
Government,"Open Government, Victoria State Government",Victoria State Government Open Data,No,Yes,Unknown,https://www.data.vic.gov.au/
Government,"Open Government, West Australia",West Australia Open Data,No,Yes,Unknown,https://data.wa.gov.au/
Government,PRC Exam Schedule,Unofficial Philippine Professional Regulation Commission's examination schedule,No,Yes,Yes,https://api.whenisthenextboardexam.com/docs/
Government,Represent by Open North,Find Canadian Government Representatives,No,Yes,Unknown,https://represent.opennorth.ca/
Government,UK Companies House,UK Companies House Data from the UK government,`OAuth`,Yes,Unknown,https://developer.company-information.service.gov.uk/
Government,US Presidential Election Data by TogaTech,Basic candidate data and live electoral vote counts for top two parties in US presidential election,No,Yes,No,https://uselection.togatech.org/api/
Government,USA.gov,"Authoritative information on U.S. programs, events, services and more",`apiKey`,Yes,Unknown,https://www.usa.gov/developer
Government,USAspending.gov,US federal spending data,No,Yes,Unknown,https://api.usaspending.gov/
Health,CMS.gov,Access to the data from the CMS - medicare.gov,`apiKey`,Yes,Unknown,https://data.cms.gov/provider-data/
Health,Coronavirus,HTTP API for Latest Covid-19 Data,No,Yes,Unknown,https://pipedream.com/@pravin/http-api-for-latest-wuhan-coronavirus-data-2019-ncov-p_G6CLVM/readme
Health,Coronavirus in the UK,"UK Government coronavirus data, including deaths and cases by region",No,Yes,Unknown,https://coronavirus.data.gov.uk/details/developers-guide
Health,Covid Tracking Project,Covid-19  data for the US,No,Yes,No,https://covidtracking.com/data/api/version-2
Health,Covid-19,"Covid 19 spread, infection and recovery",No,Yes,Yes,https://covid19api.com/
Health,Covid-19,"Covid 19 cases, deaths and recovery per country",No,Yes,Yes,https://github.com/M-Media-Group/Covid-19-API
Health,Covid-19 Datenhub,"Maps, datasets, applications and more in the context of COVID-19",No,Yes,Unknown,https://npgeo-corona-npgeo-de.hub.arcgis.com
Health,Covid-19 Government Response,Government measures tracker to fight against the Covid-19 pandemic,No,Yes,Yes,https://covidtracker.bsg.ox.ac.uk
Health,Covid-19 India,"Covid 19 statistics state and district wise about cases, vaccinations, recovery within India",No,Yes,Unknown,https://data.covid19india.org/
Health,Covid-19 JHU CSSE,Open-source API for exploring Covid19 cases based on JHU CSSE,No,Yes,Yes,https://nuttaphat.com/covid19-api/
Health,Covid-19 Live Data,"Global and countrywise data of Covid 19 daily Summary, confirmed cases, recovered and deaths",No,Yes,Yes,https://github.com/mathdroid/covid-19-api
Health,Covid-19 Philippines,Unofficial Covid-19 Web API for Philippines from data collected by DOH,No,Yes,Yes,https://github.com/Simperfy/Covid-19-API-Philippines-DOH
Health,COVID-19 Tracker Canada,Details on Covid-19 cases across Canada,No,Yes,Unknown,https://api.covid19tracker.ca/docs/1.0/overview
Health,COVID-19 Tracker Sri Lanka,Provides situation of the COVID-19 patients reported in Sri Lanka,No,Yes,Unknown,https://www.hpb.health.gov.lk/en/api-documentation
Health,COVID-ID,Indonesian government Covid data per province,No,Yes,Yes,https://data.covid19.go.id/public/api/prov.json
Health,Dataflow Kit COVID-19,COVID-19 live statistics into sites per hour,No,Yes,Unknown,https://covid-19.dataflowkit.com
Health,FoodData Central,National Nutrient Database for Standard Reference,`apiKey`,Yes,Unknown,https://fdc.nal.usda.gov/
Health,Healthcare.gov,Educational content about the US Health Insurance Marketplace,No,Yes,Unknown,https://www.healthcare.gov/developers/
