category,api,description,auth,https,cors,link
Health,Humanitarian Data Exchange,Humanitarian Data Exchange (HDX) is open platform for sharing data across crises and organisations,No,Yes,Unknown,https://data.humdata.org/
Health,Infermedica,NLP based symptom checker and patient triage API for health diagnosis from text,`apiKey`,Yes,Yes,https://developer.infermedica.com/docs/
Health,LAPIS,SARS-CoV-2 genomic sequences from public sources,No,Yes,Yes,https://cov-spectrum.ethz.ch/public
Health,Lexigram,"NLP that extracts mentions of clinical concepts from text, gives access to clinical ontology",`apiKey`,Yes,Unknown,https://docs.lexigram.io/
Health,Makeup,Makeup Information,No,No,Unknown,http://makeup-api.herokuapp.com/
Health,MyVaccination,Vaccination data for Malaysia,No,Yes,Unknown,https://documenter.getpostman.com/view/16605343/Tzm8GG7u
Health,NPPES,"National Plan & Provider Enumeration System, info on healthcare providers registered in US",No,Yes,Unknown,https://npiregistry.cms.hhs.gov/registry/help-api
Health,Nutritionix,Worlds largest verified nutrition database,`apiKey`,Yes,Unknown,https://developer.nutritionix.com/
Health,Open Data NHS Scotland,Medical reference data and statistics by Public Health Scotland,No,Yes,Unknown,https://www.opendata.nhs.scot
Health,Open Disease,API for Current cases and more stuff about COVID-19 and Influenza,No,Yes,Yes,https://disease.sh/
Health,openFDA,"Public FDA data about drugs, devices and foods",`apiKey`,Yes,Unknown,https://open.fda.gov
Health,Orion Health,Medical platform which allows the development of applications for different healthcare scenarios,`OAuth`,Yes,Unknown,https://developer.orionhealth.io/
Health,Quarantine,Coronavirus API with free COVID-19 live updates,No,Yes,Yes,https://quarantine.country/coronavirus/api/
Jobs,Adzuna,Job board aggregator,`apiKey`,Yes,Unknown,https://developer.adzuna.com/overview
Jobs,Arbeitnow,API for Job board aggregator in Europe / Remote,No,Yes,Yes,https://documenter.getpostman.com/view/18545278/UVJbJdKh
Jobs,Arbeitsamt,"API for the ""Arbeitsamt"", which is a german Job board aggregator",`OAuth`,Yes,Unknown,https://jobsuche.api.bund.dev/
Jobs,Careerjet,Job search engine,`apiKey`,No,Unknown,https://www.careerjet.com/partners/api/
Jobs,DevITjobs UK,Jobs with GraphQL,No,Yes,Yes,https://devitjobs.uk/job_feed.xml
Jobs,Findwork,Job board,`apiKey`,Yes,Unknown,https://findwork.dev/developers/
Jobs,GraphQL Jobs,Jobs with GraphQL,No,Yes,Yes,https://graphql.jobs/docs/api/
Jobs,Jobs2Careers,Job aggregator,`apiKey`,Yes,Unknown,http://api.jobs2careers.com/api/spec.pdf
Jobs,Jooble,Job search engine,`apiKey`,Yes,Unknown,https://jooble.org/api/about
Jobs,Juju,Job search engine,`apiKey`,No,Unknown,http://www.juju.com/publisher/spec/
Jobs,Open Skills,"Job titles, skills and related jobs data",No,No,Unknown,https://github.com/workforce-data-initiative/skills-api/wiki/API-Overview
Jobs,Reed,Job board aggregator,`apiKey`,Yes,Unknown,https://www.reed.co.uk/developers
Jobs,The Muse,Job board and company profiles,`apiKey`,Yes,Unknown,https://www.themuse.com/developers/api/v2
Jobs,Upwork,Freelance job board and management system,`OAuth`,Yes,Unknown,https://developers.upwork.com/
Jobs,USAJOBS,US government job board,`apiKey`,Yes,Unknown,https://developer.usajobs.gov/
Jobs,WhatJobs,Job search engine,`apiKey`,Yes,Unknown,https://www.whatjobs.com/affiliates
Jobs,ZipRecruiter,Job search app and website,`apiKey`,Yes,Unknown,https://www.ziprecruiter.com/publishers
Machine Learning,AI For Thai,Free Various Thai AI API,`apiKey`,Yes,Yes,https://aiforthai.in.th/index.php
Machine Learning,Clarifai,Computer Vision,`OAuth`,Yes,Unknown,https://docs.clarifai.com/api-guide/api-overview
Machine Learning,Cloudmersive,"Image captioning, face recognition, NSFW classification",`apiKey`,Yes,Yes,https://www.cloudmersive.com/image-recognition-and-processing-api
Machine Learning,Deepcode,AI for code review,No,Yes,Unknown,https://www.deepcode.ai
Machine Learning,Dialogflow,Natural Language Processing,`apiKey`,Yes,Unknown,https://cloud.google.com/dialogflow/docs/
Machine Learning,EXUDE-API,"Used for the primary ways for filtering the stopping, stemming words from the text data",No,Yes,Yes,http://uttesh.com/exude-api/
Machine Learning,Hirak FaceAPI,"Face detection, face recognition with age estimation/gender estimation, accurate, no quota limits",`apiKey`,Yes,Unknown,https://faceapi.hirak.site/
Machine Learning,Imagga,"Image Recognition Solutions like Tagging, Visual Search, NSFW moderation",`apiKey`,Yes,Unknown,https://imagga.com/
Machine Learning,Inferdo,"Computer Vision services like Facial detection, Image labeling, NSFW classification",`apiKey`,Yes,Unknown,https://rapidapi.com/user/inferdo
Machine Learning,IPS Online,Face and License Plate Anonymization,`apiKey`,Yes,Unknown,https://docs.identity.ps/docs
Machine Learning,Irisnet,Realtime content moderation API that blocks or blurs unwanted images in real-time,`apiKey`,Yes,Yes,https://irisnet.de/api/
Machine Learning,Keen IO,Data Analytics,`apiKey`,Yes,Unknown,https://keen.io/
Machine Learning,Machinetutors,"AI Solutions: Video/Image Classification & Tagging, NSFW, Icon/Image/Audio Search, NLP",`apiKey`,Yes,Yes,https://www.machinetutors.com/portfolio/MT_api.html
Machine Learning,MessengerX.io,A FREE API for developers to build and monetize personalized ML based chat apps,`apiKey`,Yes,Yes,https://messengerx.rtfd.io
Machine Learning,NLP Cloud,"NLP API using spaCy and transformers for NER, sentiments, classification, summarization, and more",`apiKey`,Yes,Unknown,https://nlpcloud.io
Machine Learning,OpenVisionAPI,Open source computer vision API based on open source models,No,Yes,Yes,https://openvisionapi.com
Machine Learning,Perspective,"NLP API to return probability that if text is toxic, obscene, insulting or threatening",`apiKey`,Yes,Unknown,https://perspectiveapi.com
Machine Learning,Roboflow Universe,Pre-trained computer vision models,`apiKey`,Yes,Yes,https://universe.roboflow.com
Machine Learning,SkyBiometry,"Face Detection, Face Recognition and Face Grouping",`apiKey`,Yes,Unknown,https://skybiometry.com/documentation/
Machine Learning,Time Door,A time series analysis API,`apiKey`,Yes,Yes,https://timedoor.io
Machine Learning,Unplugg,Forecasting API for timeseries data,`apiKey`,Yes,Unknown,https://unplu.gg/test_api.html
Machine Learning,WolframAlpha,Provides specific answers to questions using data and algorithms,`apiKey`,Yes,Unknown,https://products.wolframalpha.com/api/
Music,7digital,Api of Music store 7digital,`OAuth`,Yes,Unknown,https://docs.7digital.com/reference
Music,AI Mastering,Automated Music Mastering,`apiKey`,Yes,Yes,https://aimastering.com/api_docs/
Music,Audiomack,Api of the streaming music hub Audiomack,`OAuth`,Yes,Unknown,https://www.audiomack.com/data-api/docs
Music,Bandcamp,API of Music store Bandcamp,`OAuth`,Yes,Unknown,https://bandcamp.com/developer
Music,Bandsintown,Music Events,No,Yes,Unknown,https://app.swaggerhub.com/apis/Bandsintown/PublicAPI/3.0.0
Music,Deezer,Music,`OAuth`,Yes,Unknown,https://developers.deezer.com/api
Music,Discogs,Music,`OAuth`,Yes,Unknown,https://www.discogs.com/developers/
Music,Freesound,Music Samples,`apiKey`,Yes,Unknown,https://freesound.org/docs/api/
Music,Gaana,API to retrieve song information from Gaana,No,Yes,Unknown,https://github.com/cyberboysumanjay/GaanaAPI
Music,Genius,Crowdsourced lyrics and music knowledge,`OAuth`,Yes,Unknown,https://docs.genius.com/
Music,Genrenator,Music genre generator,No,Yes,Unknown,https://binaryjazz.us/genrenator-api/
Music,iTunes Search,Software products,No,Yes,Unknown,https://affiliate.itunes.apple.com/resources/documentation/itunes-store-web-service-search-api/
Music,Jamendo,Music,`OAuth`,Yes,Unknown,https://developer.jamendo.com/v3.0/docs
Music,JioSaavn,"API to retrieve song information, album meta data and many more from JioSaavn",No,Yes,Unknown,https://github.com/cyberboysumanjay/JioSaavnAPI
Music,KKBOX,"Get music libraries, playlists, charts, and perform out of KKBOX's platform",`OAuth`,Yes,Unknown,https://developer.kkbox.com
Music,KSoft.Si Lyrics,API to get lyrics for songs,`apiKey`,Yes,Unknown,https://docs.ksoft.si/api/lyrics-api
Music,LastFm,Music,`apiKey`,Yes,Unknown,https://www.last.fm/api
Music,Lyrics.ovh,Simple API to retrieve the lyrics of a song,No,Yes,Unknown,https://lyricsovh.docs.apiary.io
Music,Mixcloud,Music,`OAuth`,Yes,Yes,https://www.mixcloud.com/developers/
Music,MusicBrainz,Music,No,Yes,Unknown,https://musicbrainz.org/doc/Development/XML_Web_Service/Version_2
Music,Musixmatch,Music,`apiKey`,Yes,Unknown,https://developer.musixmatch.com/
Music,Napster,Music,`apiKey`,Yes,Yes,https://developer.napster.com/api/v2.2
Music,Openwhyd,"Download curated playlists of streaming tracks (YouTube, SoundCloud, etc...)",No,Yes,No,https://openwhyd.github.io/openwhyd/API
Music,Phishin,A web-based archive of legal live audio recordings of the improvisational rock band Phish,`apiKey`,Yes,No,https://phish.in/api-docs
Music,Radio Browser,List of internet radio stations,No,Yes,Yes,https://api.radio-browser.info/
Music,Songkick,Music Events,`apiKey`,Yes,Unknown,https://www.songkick.com/developer/
Music,Songlink / Odesli,Get all the services on which a song is available,`apiKey`,Yes,Yes,https://www.notion.so/API-d0ebe08a5e304a55928405eb682f6741
Music,Songsterr,"Provides guitar, bass and drums tabs and chords",No,Yes,Unknown,https://www.songsterr.com/a/wa/api/
Music,SoundCloud,With SoundCloud API you can build applications that will give more power to control your content,`OAuth`,Yes,Unknown,https://developers.soundcloud.com/docs/api/guide
Music,Spotify,"View Spotify music catalog, manage users' libraries, get recommendations and more",`OAuth`,Yes,Unknown,https://beta.developer.spotify.com/documentation/web-api/
Music,TasteDive,Similar artist API (also works for movies and TV shows),`apiKey`,Yes,Unknown,https://tastedive.com/read/api
Music,TheAudioDB,Music,`apiKey`,Yes,Unknown,https://www.theaudiodb.com/api_guide.php
Music,Vagalume,Crowdsourced lyrics and music knowledge,`apiKey`,Yes,Unknown,https://api.vagalume.com.br/docs/
News,apilayer mediastack,"Free, Simple REST API for Live News & Blog Articles",`apiKey`,Yes,Unknown,https://mediastack.com/
News,Associated Press,Search for news and metadata from Associated Press,`apiKey`,Yes,Unknown,https://developer.ap.org/
News,Chronicling America,Provides access to millions of pages of historic US newspapers from the Library of Congress,No,No,Unknown,http://chroniclingamerica.loc.gov/about/api/
News,Currents,"Latest news published in various news sources, blogs and forums",`apiKey`,Yes,Yes,https://currentsapi.services/
News,Feedbin,RSS reader,`OAuth`,Yes,Unknown,https://github.com/feedbin/feedbin-api
News,GNews,Search for news from various sources,`apiKey`,Yes,Yes,https://gnews.io/
News,Graphs for Coronavirus,Each Country separately and Worldwide Graphs for Coronavirus. Daily updates,No,Yes,Yes,https://corona.dnsforfamily.com/api.txt
News,Inshorts News,Provides news from inshorts,No,Yes,Unknown,https://github.com/cyberboysumanjay/Inshorts-News-API
News,MarketAux,Live stock market news with tagged tickers + sentiment and stats JSON API,`apiKey`,Yes,Yes,https://www.marketaux.com/
News,New York Times,The New York Times Developer Network,`apiKey`,Yes,Unknown,https://developer.nytimes.com/
News,News,Headlines currently published on a range of news sources and blogs,`apiKey`,Yes,Unknown,https://newsapi.org/
News,NewsData,News data API for live-breaking news and headlines from reputed  news sources,`apiKey`,Yes,Unknown,https://newsdata.io/docs
News,NewsX,Get or Search Latest Breaking News with ML Powered Summaries 🤖,`apiKey`,Yes,Unknown,https://rapidapi.com/machaao-inc-machaao-inc-default/api/newsx/
News,NPR One,Personalized news listening experience from NPR,`OAuth`,Yes,Unknown,http://dev.npr.org/api/
News,Spaceflight News,Spaceflight related news 🚀,No,Yes,Yes,https://spaceflightnewsapi.net
News,The Guardian,"Access all the content the Guardian creates, categorised by tags and section",`apiKey`,Yes,Unknown,http://open-platform.theguardian.com/
News,The Old Reader,RSS reader,`apiKey`,Yes,Unknown,https://github.com/theoldreader/api
News,TheNews,"Aggregated headlines, top story and live news JSON API",`apiKey`,Yes,Yes,https://www.thenewsapi.com/
News,Trove,Search through the National Library of Australia collection of 1000s of digitised newspapers,`apiKey`,Yes,Unknown,https://trove.nla.gov.au/about/create-something/using-api
Open Data,18F,Unofficial US Federal Government API Development,No,No,Unknown,http://18f.github.io/API-All-the-X/
Open Data,API Setu,"An Indian Government platform that provides a lot of APIS for KYC, business, education & employment",No,Yes,Yes,https://www.apisetu.gov.in/
Open Data,Archive.org,The Internet Archive,No,Yes,No,https://archive.readme.io/docs
Open Data,Black History Facts,Contribute or search one of the largest black history fact databases on the web,`apiKey`,Yes,Yes,https://www.blackhistoryapi.io/docs
Open Data,BotsArchive,JSON formatted details about Telegram Bots available in database,No,Yes,Unknown,https://botsarchive.com/docs.html
Open Data,Callook.info,United States ham radio callsigns,No,Yes,Unknown,https://callook.info
Open Data,CARTO,Location Information Prediction,`apiKey`,Yes,Unknown,https://carto.com/
Open Data,CollegeScoreCard.ed.gov,Data on higher education institutions in the United States,No,Yes,Unknown,https://collegescorecard.ed.gov/data/
Open Data,Enigma Public,Broadest collection of public data,`apiKey`,Yes,Yes,https://developers.enigma.com/docs
Open Data,French Address Search,Address search via the French Government,No,Yes,Unknown,https://geo.api.gouv.fr/adresse
Open Data,GENESIS,Federal Statistical Office Germany,`OAuth`,Yes,Unknown,https://www.destatis.de/EN/Service/OpenData/api-webservice.html
Open Data,Joshua Project,People groups of the world with the fewest followers of Christ,`apiKey`,Yes,Unknown,https://api.joshuaproject.net/
Open Data,Kaggle,"Create and interact with Datasets, Notebooks, and connect with Kaggle",`apiKey`,Yes,Unknown,https://www.kaggle.com/docs/api
Open Data,LinkPreview,"Get JSON formatted summary with title, description and preview image for any requested URL",`apiKey`,Yes,Yes,https://www.linkpreview.net
Open Data,Lowy Asia Power Index,Get measure resources and influence to rank the relative power of states in Asia,No,Yes,Unknown,https://github.com/0x0is1/lowy-index-api-docs
Open Data,Microlink.io,Extract structured data from any website,No,Yes,Yes,https://microlink.io
Open Data,Nasdaq Data Link,Stock market data,`apiKey`,Yes,Unknown,https://docs.data.nasdaq.com/
Open Data,Nobel Prize,Open data about nobel prizes and events,No,Yes,Yes,https://www.nobelprize.org/about/developer-zone-2/
Open Data,Open Data Minneapolis,Spatial (GIS) and non-spatial city data for Minneapolis,No,Yes,No,https://opendata.minneapolismn.gov/
Open Data,openAFRICA,Large datasets repository of African open data,No,Yes,Unknown,https://africaopendata.org/
Open Data,OpenCorporates,Data on corporate entities and directors in many countries,`apiKey`,Yes,Unknown,http://api.opencorporates.com/documentation/API-Reference
Open Data,OpenSanctions,"Data on international sanctions, crime and politically exposed persons",No,Yes,Yes,https://www.opensanctions.org/docs/api/
Open Data,PeakMetrics,News articles and public datasets,`apiKey`,Yes,Unknown,https://rapidapi.com/peakmetrics-peakmetrics-default/api/peakmetrics-news
Open Data,Recreation Information Database,"Recreational areas, federal lands, historic sites, museums, and other attractions/resources(US)",`apiKey`,Yes,Unknown,https://ridb.recreation.gov/
Open Data,Scoop.it,Content Curation Service,`apiKey`,No,Unknown,http://www.scoop.it/dev
Open Data,Socrata,"Access to Open Data from Governments, Non-profits and NGOs around the world",`OAuth`,Yes,Yes,https://dev.socrata.com/
Open Data,Teleport,Quality of Life Data,No,Yes,Unknown,https://developers.teleport.org/
Open Data,Umeå Open Data,Open data of the city Umeå in northen Sweden,No,Yes,Yes,https://opendata.umea.se/api/
Open Data,Universities List,"University names, countries and domains",No,Yes,Unknown,https://github.com/Hipo/university-domains-list
Open Data,University of Oslo,"Courses, lecture videos, detailed information for courses etc. for the University of Oslo (Norway)",No,Yes,Unknown,https://data.uio.no/
Open Data,UPC database,More than 1.5 million barcode numbers from all around the world,`apiKey`,Yes,Unknown,https://upcdatabase.org/api
Open Data,Urban Observatory,The largest set of publicly available real time urban data in the UK,No,No,No,https://urbanobservatory.ac.uk
Open Data,Wikidata,Collaboratively edited knowledge base operated by the Wikimedia Foundation,`OAuth`,Yes,Unknown,https://www.wikidata.org/w/api.php?action=help
Open Data,Wikipedia,Mediawiki Encyclopedia,No,Yes,Unknown,https://www.mediawiki.org/wiki/API:Main_page
Open Data,Yelp,Find Local Business,`OAuth`,Yes,Unknown,https://www.yelp.com/developers/documentation/v3
Open Source Projects,Countly,Countly web analytics,No,No,Unknown,https://api.count.ly/reference
Open Source Projects,Creative Commons Catalog,Search among openly licensed and public domain works,`OAuth`,Yes,Yes,https://api.creativecommons.engineering/
Open Source Projects,Datamuse,Word-finding query engine,No,Yes,Unknown,https://www.datamuse.com/api/
Open Source Projects,Drupal.org,Drupal.org,No,Yes,Unknown,https://www.drupal.org/drupalorg/docs/api
Open Source Projects,Evil Insult Generator,Evil Insults,No,Yes,Yes,https://evilinsult.com/api
Open Source Projects,GitHub Contribution Chart Generator,Create an image of your GitHub contributions,No,Yes,Yes,https://github-contributions.vercel.app
Open Source Projects,GitHub ReadMe Stats,Add dynamically generated statistics to your GitHub profile ReadMe,No,Yes,Yes,https://github.com/anuraghazra/github-readme-stats
Open Source Projects,Metabase,An open source Business Intelligence server to share data and analytics inside your company,No,Yes,Yes,https://www.metabase.com/
Open Source Projects,Shields,"Concise, consistent, and legible badges in SVG and raster format",No,Yes,Unknown,https://shields.io/
Patent,EPO,European patent search system api,`OAuth`,Yes,Unknown,https://developers.epo.org/
Patent,PatentsView ,API is intended to explore and visualize trends/patterns across the US innovation landscape,No,Yes,Unknown,https://patentsview.org/apis/purpose
Patent,TIPO,Taiwan patent search system api,`apiKey`,Yes,Unknown,https://tiponet.tipo.gov.tw/Gazette/OpenData/OD/OD05.aspx?QryDS=API00
Patent,USPTO,USA patent api services,No,Yes,Unknown,https://www.uspto.gov/learning-and-resources/open-data-and-mobility
Personality,Advice Slip,Generate random advice slips,No,Yes,Unknown,http://api.adviceslip.com/
Personality,Biriyani As A Service,Biriyani images placeholder,No,Yes,No,https://biriyani.anoram.com/
Personality,Dev.to,"Access Forem articles, users and other resources via API",`apiKey`,Yes,Unknown,https://developers.forem.com/api
Personality,Dictum,API to get access to the collection of the most inspiring expressions of mankind,No,Yes,Unknown,https://github.com/fisenkodv/dictum
Personality,FavQs.com,"FavQs allows you to collect, discover and share your favorite quotes",`apiKey`,Yes,Unknown,https://favqs.com/api
Personality,FOAAS,Fuck Off As A Service,No,No,Unknown,http://www.foaas.com/
Personality,Forismatic,Inspirational Quotes,No,No,Unknown,http://forismatic.com/en/api/
Personality,icanhazdadjoke,The largest selection of dad jokes on the internet,No,Yes,Unknown,https://icanhazdadjoke.com/api
Personality,Inspiration,Motivational and Inspirational quotes,No,Yes,Yes,https://inspiration.goprogram.ai/docs/
Personality,kanye.rest,REST API for random Kanye West quotes,No,Yes,Yes,https://kanye.rest
Personality,kimiquotes,Team radio and interview quotes by Finnish F1 legend Kimi Räikkönen,No,Yes,Yes,https://kimiquotes.herokuapp.com/doc
Personality,Medium,Community of readers and writers offering unique perspectives on ideas,`OAuth`,Yes,Unknown,https://github.com/Medium/medium-api-docs
Personality,Programming Quotes,Programming Quotes API for open source projects,No,Yes,Unknown,https://github.com/skolakoda/programming-quotes-api
Personality,Quotable Quotes,"Quotable is a free, open source quotations API",No,Yes,Unknown,https://github.com/lukePeavey/quotable
Personality,Quote Garden,REST API for more than 5000 famous quotes,No,Yes,Unknown,https://pprathameshmore.github.io/QuoteGarden/
Personality,quoteclear,Ever-growing list of James Clear quotes from the 3-2-1 Newsletter,No,Yes,Yes,https://quoteclear.web.app/
Personality,Quotes on Design,Inspirational Quotes,No,Yes,Unknown,https://quotesondesign.com/api/
Personality,Stoicism Quote,Quotes about Stoicism,No,Yes,Unknown,https://github.com/tlcheah2/stoic-quote-lambda-public-api
Personality,They Said So Quotes,Quotes Trusted by many fortune brands around the world,No,Yes,Unknown,https://theysaidso.com/api/
Personality,Traitify,"Assess, collect and analyze Personality",No,Yes,Unknown,https://app.traitify.com/developer
Personality,Udemy(instructor),API for instructors on Udemy,`apiKey`,Yes,Unknown,https://www.udemy.com/developers/instructor/
Personality,Vadivelu HTTP Codes,On demand HTTP Codes with images,No,Yes,No,https://vadivelu.anoram.com/
Personality,Zen Quotes,Large collection of Zen quotes for inspiration,No,Yes,Yes,https://zenquotes.io/
Phone,Abstract Phone Validation,Validate phone numbers globally,`apiKey`,Yes,Yes,https://www.abstractapi.com/phone-validation-api
Phone,apilayer numverify,Phone number validation,`apiKey`,Yes,Unknown,https://numverify.com
Phone,Cloudmersive Validate,Validate international phone numbers,`apiKey`,Yes,Yes,https://cloudmersive.com/phone-number-validation-API
Phone,Phone Specification,Rest Api for Phone specifications,No,Yes,Yes,https://github.com/azharimm/phone-specs-api
Phone,Veriphone,Phone number validation & carrier lookup,`apiKey`,Yes,Yes,https://veriphone.io
Photography,apilayer screenshotlayer,URL 2 Image,No,Yes,Unknown,https://screenshotlayer.com
Photography,APITemplate.io,Dynamically generate images and PDFs from templates with a simple API,`apiKey`,Yes,Yes,https://apitemplate.io
Photography,Bruzu,Image generation with query string,`apiKey`,Yes,Yes,https://docs.bruzu.com
Photography,CheetahO,Photo optimization and resize,`apiKey`,Yes,Unknown,https://cheetaho.com/docs/getting-started/
Photography,Dagpi,Image manipulation and processing,`apiKey`,Yes,Unknown,https://dagpi.xyz
Photography,Duply,"Generate, Edit, Scale and Manage Images and Videos Smarter & Faster",`apiKey`,Yes,Yes,https://duply.co/docs#getting-started-api
Photography,DynaPictures,Generate Hundreds of Personalized Images in Minutes,`apiKey`,Yes,Yes,https://dynapictures.com/docs/
Photography,Flickr,Flickr Services,`OAuth`,Yes,Unknown,https://www.flickr.com/services/api/
Photography,Getty Images,Build applications using the world's most powerful imagery,`OAuth`,Yes,Unknown,http://developers.gettyimages.com/en/
Photography,Gfycat,Jiffier GIFs,`OAuth`,Yes,Unknown,https://developers.gfycat.com/api/
Photography,Giphy,Get all your gifs,`apiKey`,Yes,Unknown,https://developers.giphy.com/docs/
Photography,Google Photos,Integrate Google Photos with your apps or devices,`OAuth`,Yes,Unknown,https://developers.google.com/photos
Photography,Image Upload,Image Optimization,`apiKey`,Yes,Unknown,https://apilayer.com/marketplace/image_upload-api
Photography,Imgur,Images,`OAuth`,Yes,Unknown,https://apidocs.imgur.com/
Photography,Imsea,Free image search,No,Yes,Unknown,https://imsea.herokuapp.com/
Photography,Lorem Picsum,Images from Unsplash,No,Yes,Unknown,https://picsum.photos/
Photography,ObjectCut,Image Background removal,`apiKey`,Yes,Yes,https://objectcut.com/
Photography,Pexels,Free Stock Photos and Videos,`apiKey`,Yes,Yes,https://www.pexels.com/api/
Photography,PhotoRoom,Remove background from images,`apiKey`,Yes,Unknown,https://www.photoroom.com/api/
Photography,Pixabay,Photography,`apiKey`,Yes,Unknown,https://pixabay.com/sk/service/about/api/
Photography,PlaceKeanu,Resizable Keanu Reeves placeholder images with grayscale and young Keanu options,No,Yes,Unknown,https://placekeanu.com/
Photography,Readme typing SVG,Customizable typing and deleting text SVG,No,Yes,Unknown,https://github.com/DenverCoder1/readme-typing-svg
Photography,Remove.bg,Image Background removal,`apiKey`,Yes,Unknown,https://www.remove.bg/api
Photography,ReSmush.it,Photo optimization,No,No,Unknown,https://resmush.it/api
Photography,shutterstock,Stock Photos and Videos,`OAuth`,Yes,Unknown,https://api-reference.shutterstock.com/
Photography,Sirv,"Image management solutions like optimization, manipulation, hosting",`apiKey`,Yes,Unknown,https://apidocs.sirv.com/
Photography,Unsplash,Photography,`OAuth`,Yes,Unknown,https://unsplash.com/developers
Photography,Wallhaven,Wallpapers,`apiKey`,Yes,Unknown,https://wallhaven.cc/help/api
Photography,Webdam,Images,`OAuth`,Yes,Unknown,https://www.damsuccess.com/hc/en-us/articles/202134055-REST-API
Programming,Codeforces,Get access to Codeforces data,`apiKey`,Yes,Unknown,https://codeforces.com/apiHelp
Programming,Hackerearth,For compiling and running code in several languages,`apiKey`,Yes,Unknown,https://www.hackerearth.com/docs/wiki/developers/v4/
Programming,Judge0 CE,Online code execution system,`apiKey`,Yes,Unknown,https://ce.judge0.com/
Programming,KONTESTS,For upcoming and ongoing competitive coding contests,No,Yes,Unknown,https://kontests.net/api
Programming,Mintlify,For programmatically generating documentation for code,`apiKey`,Yes,Yes,https://docs.mintlify.com
Science & Math,arcsecond.io,Multiple astronomy data sources,No,Yes,Unknown,https://api.arcsecond.io/
