category,api,description,auth,https,cors,link
Documents & Productivity,iLovePDF,"Convert, merge, split, extract text and add page numbers for PDFs. Free for 250 documents/month",`apiKey`,Yes,Yes,https://developer.ilovepdf.com/
Documents & Productivity,JIRA,JIRA is a proprietary issue tracking product that allows bug tracking and agile project management,`OAuth`,Yes,Unknown,https://developer.atlassian.com/server/jira/platform/rest-apis/
Documents & Productivity,Mattermost,An open source platform for developer collaboration,`OAuth`,Yes,Unknown,https://api.mattermost.com/
Documents & Productivity,Mercury,Web parser,`apiKey`,Yes,Unknown,https://mercury.postlight.com/web-parser/
Documents & Productivity,Monday,Programmatically access and update data inside a monday.com account,`apiKey`,Yes,Unknown,https://api.developer.monday.com/docs
Documents & Productivity,Notion,Integrate with Notion,`OAuth`,Yes,Unknown,https://developers.notion.com/docs/getting-started
Documents & Productivity,PandaDoc,DocGen and eSignatures API,`apiKey`,Yes,No,https://developers.pandadoc.com
Documents & Productivity,Pocket,Bookmarking service,`OAuth`,Yes,Unknown,https://getpocket.com/developer/
Documents & Productivity,Podio,File sharing and productivity,`OAuth`,Yes,Unknown,https://developers.podio.com
Documents & Productivity,PrexView,"Data from XML or JSON to PDF, HTML or Image",`apiKey`,Yes,Unknown,https://prexview.com
Documents & Productivity,Restpack,"Provides screenshot, HTML to PDF and content extraction APIs",`apiKey`,Yes,Unknown,https://restpack.io/
Documents & Productivity,Todoist,Todo Lists,`OAuth`,Yes,Unknown,https://developer.todoist.com
Documents & Productivity,Smart Image Enhancement API,Performs image upscaling by adding detail to images through multiple super-resolution algorithms,`apiKey`,Yes,Unknown,https://apilayer.com/marketplace/image_enhancement-api
Documents & Productivity,Vector Express v2.0,Free vector file converting API,No,Yes,No,https://vector.express
Documents & Productivity,WakaTime,Automated time tracking leaderboards for programmers,No,Yes,Unknown,https://wakatime.com/developers
Documents & Productivity,Zube,Full stack project management,`OAuth`,Yes,Unknown,https://zube.io/docs/api
Email,Abstract Email Validation,Validate email addresses for deliverability and spam,`apiKey`,Yes,Yes,https://www.abstractapi.com/email-verification-validation-api
Email,apilayer mailboxlayer,Email address validation,`apiKey`,Yes,Unknown,https://mailboxlayer.com
Email,Cloudmersive Validate,"Validate email addresses, phone numbers, VAT numbers and domain names",`apiKey`,Yes,Yes,https://cloudmersive.com/validate-api
Email,Disify,Validate and detect disposable and temporary email addresses,No,Yes,Yes,https://www.disify.com/
Email,DropMail,GraphQL API for creating and managing ephemeral e-mail inboxes,No,Yes,Unknown,https://dropmail.me/api/#live-demo
Email,EVA,Validate email addresses,No,Yes,Yes,https://eva.pingutil.com/
Email,Guerrilla Mail,Disposable temporary Email addresses,No,Yes,Unknown,https://www.guerrillamail.com/GuerrillaMailAPI.html
Email,ImprovMX,API for free email forwarding service,`apiKey`,Yes,Unknown,https://improvmx.com/api
Email,Kickbox,Email verification API,No,Yes,Yes,https://open.kickbox.com/
Email,mail.gw,10 Minute Mail,No,Yes,Yes,https://docs.mail.gw
Email,mail.tm,Temporary Email Service,No,Yes,Yes,https://docs.mail.tm
Email,MailboxValidator,Validate email address to improve deliverability,`apiKey`,Yes,Unknown,https://www.mailboxvalidator.com/api-email-free
Email,MailCheck.ai,Prevent users to sign up with temporary email addresses,No,Yes,Unknown,https://www.mailcheck.ai/#documentation
Email,Mailtrap,A service for the safe testing of emails sent from the development and staging environments,`apiKey`,Yes,Unknown,https://mailtrap.docs.apiary.io/#
Email,Sendgrid,A cloud-based SMTP provider that allows you to send emails without having to maintain email servers,`apiKey`,Yes,Unknown,https://docs.sendgrid.com/api-reference/
Email,Sendinblue,A service that provides solutions relating to marketing and/or transactional email and/or SMS,`apiKey`,Yes,Unknown,https://developers.sendinblue.com/docs
Email,Verifier,Verifies that a given email is real,`apiKey`,Yes,Yes,https://verifier.meetchopra.com/docs#/
Entertainment,chucknorris.io,JSON API for hand curated Chuck Norris jokes,No,Yes,Unknown,https://api.chucknorris.io
Entertainment,Corporate Buzz Words,REST API for Corporate Buzz Words,No,Yes,Yes,https://github.com/sameerkumar18/corporate-bs-generator-api
Entertainment,Excuser,Get random excuses for various situations,No,Yes,Unknown,https://excuser.herokuapp.com/
Entertainment,Fun Fact,A simple HTTPS api that can randomly select and return a fact from the FFA database,No,Yes,Yes,https://api.aakhilv.me
Entertainment,Imgflip,Gets an array of popular memes,No,Yes,Unknown,https://imgflip.com/api
Entertainment,Meme Maker,REST API for create your own meme,No,Yes,Unknown,https://mememaker.github.io/API/
Entertainment,NaMoMemes,Memes on Narendra Modi,No,Yes,Unknown,https://github.com/theIYD/NaMoMemes
Entertainment,Random Useless Facts,"Get useless, but true facts",No,Yes,Unknown,https://uselessfacts.jsph.pl/
Entertainment,Techy,JSON and Plaintext API for tech-savvy sounding phrases,No,Yes,Unknown,https://techy-api.vercel.app/
Entertainment,Yo Momma Jokes,REST API for Yo Momma Jokes,No,Yes,Unknown,https://github.com/beanboi7/yomomma-apiv2
Environment,BreezoMeter Pollen,Daily Forecast pollen conditions data for a specific location,`apiKey`,Yes,Unknown,https://docs.breezometer.com/api-documentation/pollen-api/v2/
Environment,Carbon Interface,API to calculate carbon (C02) emissions estimates for common C02 emitting activities,`apiKey`,Yes,Yes,https://docs.carboninterface.com/
Environment,Climatiq,Calculate the environmental footprint created by a broad range of emission-generating activities,`apiKey`,Yes,Yes,https://docs.climatiq.io
Environment,Cloverly,API calculates the impact of common carbon-intensive activities in real time,`apiKey`,Yes,Unknown,https://www.cloverly.com/carbon-offset-documentation
Environment,CO2 Offset,API calculates and validates the carbon footprint,No,Yes,Unknown,https://co2offset.io/api.html
Environment,Danish data service Energi,Open energy data from Energinet to society,No,Yes,Unknown,https://www.energidataservice.dk/
Environment,GrünstromIndex,Green Power Index for Germany (Grünstromindex/GSI),No,No,Yes,https://gruenstromindex.de/
Environment,IQAir,Air quality and weather data,`apiKey`,Yes,Unknown,https://www.iqair.com/air-pollution-data-api
Environment,Luchtmeetnet,Predicted and actual air quality components for The Netherlands (RIVM),No,Yes,Unknown,https://api-docs.luchtmeetnet.nl/
Environment,National Grid ESO,Open data from Great Britain’s Electricity System Operator,No,Yes,Unknown,https://data.nationalgrideso.com/
Environment,OpenAQ,Open air quality data,`apiKey`,Yes,Unknown,https://docs.openaq.org/
Environment,PM2.5 Open Data Portal,Open low-cost PM2.5 sensor data,No,Yes,Unknown,https://pm25.lass-net.org/#apis
Environment,PM25.in,Air quality of China,`apiKey`,No,Unknown,http://www.pm25.in/api_doc
Environment,PVWatts,Energy production photovoltaic (PV) energy systems,`apiKey`,Yes,Unknown,https://developer.nrel.gov/docs/solar/pvwatts/v6/
Environment,Srp Energy,Hourly usage energy report for Srp customers,`apiKey`,Yes,No,https://srpenergy-api-client-python.readthedocs.io/en/latest/api.html
Environment,UK Carbon Intensity,The Official Carbon Intensity API for Great Britain developed by National Grid,No,Yes,Unknown,https://carbon-intensity.github.io/api-definitions/#carbon-intensity-api-v1-0-0
Environment,Website Carbon,API to estimate the carbon footprint of loading web pages,No,Yes,Unknown,https://api.websitecarbon.com/
Events,Eventbrite,Find events,`OAuth`,Yes,Unknown,https://www.eventbrite.com/platform/api/
Events,SeatGeek,"Search events, venues and performers",`apiKey`,Yes,Unknown,https://platform.seatgeek.com/
Events,Ticketmaster,"Search events, attractions, or venues",`apiKey`,Yes,Unknown,http://developer.ticketmaster.com/products-and-docs/apis/getting-started/
Finance,Abstract VAT Validation,Validate VAT numbers and calculate VAT rates,`apiKey`,Yes,Yes,https://www.abstractapi.com/vat-validation-rates-api
Finance,Aletheia,"Insider trading data, earnings call analysis, financial statements, and more",`apiKey`,Yes,Yes,https://aletheiaapi.com/
Finance,Alpaca,Realtime and historical market data on all US equities and ETFs,`apiKey`,Yes,Yes,https://alpaca.markets/docs/api-documentation/api-v2/market-data/alpaca-data-api-v2/
Finance,Alpha Vantage,Realtime and historical stock data,`apiKey`,Yes,Unknown,https://www.alphavantage.co/
Finance,apilayer marketstack,"Real-Time, Intraday & Historical Market Data API",`apiKey`,Yes,Unknown,https://marketstack.com/
Finance,Banco do Brasil,All Banco do Brasil financial transaction APIs,`OAuth`,Yes,Yes,https://developers.bb.com.br/home
Finance,Bank Data API,Instant IBAN and SWIFT number validation across the globe,`apiKey`,Yes,Unknown,https://apilayer.com/marketplace/bank_data-api
Finance,Billplz,Payment platform,`apiKey`,Yes,Unknown,https://www.billplz.com/api
Finance,Binlist,Public access to a database of IIN/BIN information,No,Yes,Unknown,https://binlist.net/
Finance,Boleto.Cloud,A api to generate boletos in Brazil,`apiKey`,Yes,Unknown,https://boleto.cloud/
Finance,Citi,All Citigroup account and statement data APIs,`apiKey`,Yes,Unknown,https://sandbox.developerhub.citi.com/api-catalog-list
Finance,Econdb,Global macroeconomic data,No,Yes,Yes,https://www.econdb.com/api/
Finance,Fed Treasury,U.S. Department of the Treasury Data,No,Yes,Unknown,https://fiscaldata.treasury.gov/api-documentation/
Finance,Finage,"Finage is a stock, currency, cryptocurrency, indices, and ETFs real-time & historical data provider",`apiKey`,Yes,Unknown,https://finage.co.uk
Finance,Financial Modeling Prep,Realtime and historical stock data,`apiKey`,Yes,Unknown,https://site.financialmodelingprep.com/developer/docs
Finance,Finnhub,"Real-Time RESTful APIs and Websocket for Stocks, Currencies, and Crypto",`apiKey`,Yes,Unknown,https://finnhub.io/docs/api
Finance,FRED,Economic data from the Federal Reserve Bank of St. Louis,`apiKey`,Yes,Yes,https://fred.stlouisfed.org/docs/api/fred/
Finance,Front Accounting APIs,Front accounting is multilingual and multicurrency software for small businesses,`OAuth`,Yes,Yes,https://frontaccounting.com/fawiki/index.php?n=Devel.SimpleAPIModule
Finance,Hotstoks,Stock market data powered by SQL,`apiKey`,Yes,Yes,https://hotstoks.com?utm_source=public-apis
Finance,IEX Cloud,Realtime & Historical Stock and Market Data,`apiKey`,Yes,Yes,https://iexcloud.io/docs/api/
Finance,IG,Spreadbetting and CFD Market Data,`apiKey`,Yes,Unknown,https://labs.ig.com/gettingstarted
Finance,Indian Mutual Fund,Get complete history of India Mutual Funds Data,No,Yes,Unknown,https://www.mfapi.in/
Finance,Intrinio,A wide selection of financial data feeds,`apiKey`,Yes,Unknown,https://intrinio.com/
Finance,Klarna,Klarna payment and shopping service,`apiKey`,Yes,Unknown,https://docs.klarna.com/klarna-payments/api/payments-api/
Finance,MercadoPago,Mercado Pago API reference - all the information you need to develop your integrations,`apiKey`,Yes,Unknown,https://www.mercadopago.com.br/developers/es/reference
Finance,Mono,Connect with users’ bank accounts and access transaction data in Africa,`apiKey`,Yes,Unknown,https://mono.co/
Finance,Moov,"The Moov API makes it simple for platforms to send, receive, and store money",`apiKey`,Yes,Unknown,https://docs.moov.io/api/
Finance,Nordigen,Connect to bank accounts using official bank APIs and get raw transaction data,`apiKey`,Yes,Unknown,https://nordigen.com/en/account_information_documenation/integration/quickstart_guide/
Finance,OpenFIGI,"Equity, index, futures, options symbology from Bloomberg LP",`apiKey`,Yes,Yes,https://www.openfigi.com/api
Finance,Polygon,Historical stock market data,`apiKey`,Yes,Unknown,https://polygon.io/
Finance,Portfolio Optimizer,Portfolio analysis and optimization,No,Yes,Yes,https://portfoliooptimizer.io/
Finance,Razorpay IFSC,Indian Financial Systems Code (Bank Branch Codes),No,Yes,Unknown,https://razorpay.com/docs/
Finance,Real Time Finance,Websocket API to access realtime stock data,`apiKey`,No,Unknown,https://github.com/Real-time-finance/finance-websocket-API/
Finance,SEC EDGAR Data,API to access annual reports of public US companies,No,Yes,Yes,https://www.sec.gov/edgar/sec-api-documentation
Finance,SmartAPI,Gain access to set of <SmartAPI> and create end-to-end broking services,`apiKey`,Yes,Unknown,https://smartapi.angelbroking.com/
Finance,StockData,"Real-Time, Intraday & Historical Market Data, News and Sentiment API",`apiKey`,Yes,Yes,https://www.StockData.org
Finance,Styvio,Realtime and historical stock data and current stock sentiment,`apiKey`,Yes,Unknown,https://www.Styvio.com
Finance,Tax Data API,Instant VAT number and tax validation across the globe,`apiKey`,Yes,Unkown,https://apilayer.com/marketplace/tax_data-api
Finance,Tradier,"US equity/option market data (delayed, intraday, historical)",`OAuth`,Yes,Yes,https://developer.tradier.com
Finance,Twelve Data,Stock market data (real-time & historical),`apiKey`,Yes,Unknown,https://twelvedata.com/
Finance,WallstreetBets,WallstreetBets Stock Comments Sentiment Analysis,No,Yes,Unknown,https://dashboard.nbshare.io/apps/reddit/api/
Finance,Yahoo Finance,"Real time low latency Yahoo Finance API for stock market, crypto currencies, and currency exchange",`apiKey`,Yes,Yes,https://www.yahoofinanceapi.com/
Finance,YNAB,Budgeting & Planning,`OAuth`,Yes,Yes,https://api.youneedabudget.com/
Finance,Zoho Books,"Online accounting software, built for your business",`OAuth`,Yes,Unknown,https://www.zoho.com/books/api/v3/
Food & Drink,BaconMockup,Resizable bacon placeholder images,No,Yes,Yes,https://baconmockup.com/
Food & Drink,Chomp,Data about various grocery products and foods,`apiKey`,Yes,Unknown,https://chompthis.com/api/
Food & Drink,Coffee,Random pictures of coffee,No,Yes,Unknown,https://coffee.alexflipnote.dev/
Food & Drink,Edamam nutrition,Nutrition Analysis,`apiKey`,Yes,Unknown,https://developer.edamam.com/edamam-docs-nutrition-api
Food & Drink,Edamam recipes,Recipe Search,`apiKey`,Yes,Unknown,https://developer.edamam.com/edamam-docs-recipe-api
Food & Drink,Foodish,Random pictures of food dishes,No,Yes,Yes,https://github.com/surhud004/Foodish#readme
Food & Drink,Fruityvice,Data about all kinds of fruit,No,Yes,Unknown,https://www.fruityvice.com
Food & Drink,Kroger,Supermarket Data,`apiKey`,Yes,Unknown,https://developer.kroger.com/reference
Food & Drink,LCBO,Alcohol,`apiKey`,Yes,Unknown,https://lcboapi.com/
Food & Drink,Open Brewery DB,"Breweries, Cideries and Craft Beer Bottle Shops",No,Yes,Yes,https://www.openbrewerydb.org
Food & Drink,Open Food Facts,Food Products Database,No,Yes,Unknown,https://world.openfoodfacts.org/data
Food & Drink,PunkAPI,Brewdog Beer Recipes,No,Yes,Unknown,https://punkapi.com/
Food & Drink,Rustybeer,Beer brewing tools,No,Yes,No,https://rustybeer.herokuapp.com/
Food & Drink,Spoonacular,"Recipes, Food Products, and Meal Planning",`apiKey`,Yes,Unknown,https://spoonacular.com/food-api
Food & Drink,Systembolaget,Govornment owned liqour store in Sweden,`apiKey`,Yes,Unknown,https://api-portal.systembolaget.se
Food & Drink,TacoFancy,Community-driven taco database,No,No,Unknown,https://github.com/evz/tacofancy-api
Food & Drink,Tasty,"API to query data about recipe, plan, ingredients",`apiKey`,Yes,Unknown,https://rapidapi.com/apidojo/api/tasty/
Food & Drink,The Report of the Week,Food & Drink Reviews,No,Yes,Unknown,https://github.com/andyklimczak/TheReportOfTheWeek-API
Food & Drink,TheCocktailDB,Cocktail Recipes,`apiKey`,Yes,Yes,https://www.thecocktaildb.com/api.php
Food & Drink,TheMealDB,Meal Recipes,`apiKey`,Yes,Yes,https://www.themealdb.com/api.php
Food & Drink,Untappd,Social beer sharing,`OAuth`,Yes,Unknown,https://untappd.com/api/docs
Food & Drink,What's on the menu?,NYPL human-transcribed historical menu collection,`apiKey`,No,Unknown,http://nypl.github.io/menus-api/
Food & Drink,WhiskyHunter,Past online whisky auctions statistical data,No,Yes,Unknown,https://whiskyhunter.net/api/
Food & Drink,Zestful,Parse recipe ingredients,`apiKey`,Yes,Yes,https://zestfuldata.com/
Games & Comics,Age of Empires II,Get information about Age of Empires II resources,No,Yes,No,https://age-of-empires-2-api.herokuapp.com
Games & Comics,AmiiboAPI,Nintendo Amiibo Information,No,Yes,Yes,https://amiiboapi.com/
Games & Comics,Animal Crossing: New Horizons,"API for critters, fossils, art, music, furniture and villagers",No,Yes,Unknown,http://acnhapi.com/
Games & Comics,Autochess VNG,Rest Api for Autochess VNG,No,Yes,Yes,https://github.com/didadadida93/autochess-vng-api
Games & Comics,Barter.VG,"Provides information about Game, DLC, Bundles, Giveaways, Trading",No,Yes,Yes,https://github.com/bartervg/barter.vg/wiki
Games & Comics,Battle.net,"Diablo III, Hearthstone, StarCraft II and World of Warcraft game data APIs",`OAuth`,Yes,Yes,https://develop.battle.net/documentation/guides/getting-started
Games & Comics,Board Game Geek,"Board games, RPG and videogames",No,Yes,No,https://boardgamegeek.com/wiki/page/BGG_XML_API2
Games & Comics,Brawl Stars,Brawl Stars Game Information,`apiKey`,Yes,Unknown,https://developer.brawlstars.com
Games & Comics,Bugsnax,Get information about Bugsnax,No,Yes,Yes,https://www.bugsnaxapi.com/
Games & Comics,CheapShark,Steam/PC Game Prices and Deals,No,Yes,Yes,https://www.cheapshark.com/api
Games & Comics,Chess.com,Chess.com read-only REST API,No,Yes,Unknown,https://www.chess.com/news/view/published-data-api
Games & Comics,Chuck Norris Database,Jokes,No,No,Unknown,http://www.icndb.com/api/
Games & Comics,Clash of Clans,Clash of Clans Game Information,`apiKey`,Yes,Unknown,https://developer.clashofclans.com
Games & Comics,Clash Royale,Clash Royale Game Information,`apiKey`,Yes,Unknown,https://developer.clashroyale.com
Games & Comics,Comic Vine,Comics,No,Yes,Unknown,https://comicvine.gamespot.com/api/documentation
Games & Comics,Crafatar,API for Minecraft skins and faces,No,Yes,Yes,https://crafatar.com
Games & Comics,Cross Universe,Cross Universe Card Data,No,Yes,Yes,https://crossuniverse.psychpsyo.com/apiDocs.html
Games & Comics,Deck of Cards,Deck of Cards,No,No,Unknown,http://deckofcardsapi.com/
Games & Comics,Destiny The Game,Bungie Platform API,`apiKey`,Yes,Unknown,https://bungie-net.github.io/multi/index.html
Games & Comics,Digimon Information,Provides information about digimon creatures,No,Yes,Unknown,https://digimon-api.vercel.app/
Games & Comics,Digimon TCG,Search for Digimon cards in digimoncard.io,No,Yes,Unknown,https://documenter.getpostman.com/view/14059948/TzecB4fH
Games & Comics,Disney,Information of Disney characters,No,Yes,Yes,https://disneyapi.dev
Games & Comics,Dota 2,"Provides information about Player stats , Match stats, Rankings for Dota 2",`apiKey`,Yes,Unknown,https://docs.opendota.com/
Games & Comics,Dungeons and Dragons,"Reference for 5th edition spells, classes, monsters, and more",No,No,No,https://www.dnd5eapi.co/docs/
Games & Comics,Dungeons and Dragons (Alternate),Includes all monsters and spells from the SRD (System Reference Document) as well as a search API,No,Yes,Yes,https://open5e.com/
Games & Comics,Eve Online,Third-Party Developer Documentation,`OAuth`,Yes,Unknown,https://esi.evetech.net/ui
Games & Comics,FFXIV Collect,Final Fantasy XIV data on collectables,No,Yes,Yes,https://ffxivcollect.com/
Games & Comics,FIFA Ultimate Team,FIFA Ultimate Team items API,No,Yes,Unknown,https://www.easports.com/fifa/ultimate-team/api/fut/item
Games & Comics,Final Fantasy XIV,Final Fantasy XIV Game data API,No,Yes,Yes,https://xivapi.com/
Games & Comics,Fortnite,Fortnite Stats,`apiKey`,Yes,Unknown,https://fortnitetracker.com/site-api
Games & Comics,Forza,Show random image of car from Forza,No,Yes,Unknown,https://docs.forza-api.tk
Games & Comics,FreeToGame,Free-To-Play Games Database,No,Yes,Yes,https://www.freetogame.com/api-doc
Games & Comics,Fun Facts,Random Fun Facts,No,Yes,Yes,https://asli-fun-fact-api.herokuapp.com/
Games & Comics,FunTranslations,Translate Text into funny languages,No,Yes,Yes,https://api.funtranslations.com/
Games & Comics,GamerPower,Game Giveaways Tracker,No,Yes,Yes,https://www.gamerpower.com/api-read
Games & Comics,GDBrowser,Easy way to use the Geometry Dash Servers,No,Yes,Unknown,https://gdbrowser.com/api
Games & Comics,Geek-Jokes,Fetch a random geeky/programming related joke for use in all sorts of applications,No,Yes,Yes,https://github.com/sameerkumar18/geek-joke-api
Games & Comics,Genshin Impact,Genshin Impact game data,No,Yes,Yes,https://genshin.dev
Games & Comics,Giant Bomb,Video Games,`apiKey`,Yes,Unknown,https://www.giantbomb.com/api/documentation
Games & Comics,GraphQL Pokemon,GraphQL powered Pokemon API. Supports generations 1 through 8,No,Yes,Yes,https://github.com/favware/graphql-pokemon
Games & Comics,Guild Wars 2,Guild Wars 2 Game Information,`apiKey`,Yes,Unknown,https://wiki.guildwars2.com/wiki/API:Main
Games & Comics,GW2Spidy,"GW2Spidy API, Items data on the Guild Wars 2 Trade Market",No,Yes,Unknown,https://github.com/rubensayshi/gw2spidy/wiki
Games & Comics,Halo,Halo 5 and Halo Wars 2 Information,`apiKey`,Yes,Unknown,https://developer.haloapi.com/
Games & Comics,Hearthstone,Hearthstone Cards Information,`X-Mashape-Key`,Yes,Unknown,http://hearthstoneapi.com/
Games & Comics,Humble Bundle,Humble Bundle's current bundles,`apiKey`,Yes,Unknown,https://rapidapi.com/Ziggoto/api/humble-bundle
Games & Comics,Humor,"Humor, Jokes, and Memes",`apiKey`,Yes,Unknown,https://humorapi.com
Games & Comics,Hypixel,Hypixel player stats,`apiKey`,Yes,Unknown,https://api.hypixel.net/
Games & Comics,Hyrule Compendium,Data on all interactive items from The Legend of Zelda: BOTW,No,Yes,Unknown,https://github.com/gadhagod/Hyrule-Compendium-API
Games & Comics,Hytale,Hytale blog posts and jobs,No,Yes,Unknown,https://hytale-api.com/
Games & Comics,IGDB.com,Video Game Database,`apiKey`,Yes,Unknown,https://api-docs.igdb.com
Games & Comics,JokeAPI,"Programming, Miscellaneous and Dark Jokes",No,Yes,Yes,https://sv443.net/jokeapi/v2/
Games & Comics,Jokes One,Joke of the day and large category of jokes accessible via REST API,`apiKey`,Yes,Yes,https://jokes.one/api/joke/
Games & Comics,Jservice,Jeopardy Question Database,No,No,Unknown,http://jservice.io
Games & Comics,Lichess,"Access to all data of users, games, puzzles and etc on Lichess",`OAuth`,Yes,Unknown,https://lichess.org/api
Games & Comics,Magic The Gathering,Magic The Gathering Game Information,No,No,Unknown,http://magicthegathering.io/
Games & Comics,Mario Kart Tour,"API for Drivers, Karts, Gliders and Courses",`OAuth`,Yes,Unknown,https://mario-kart-tour-api.herokuapp.com/
Games & Comics,Marvel,Marvel Comics,`apiKey`,Yes,Unknown,https://developer.marvel.com
Games & Comics,Minecraft Server Status,API to get Information about a Minecraft Server,No,Yes,No,https://api.mcsrvstat.us
Games & Comics,MMO Games,"MMO Games Database, News and Giveaways",No,Yes,No,https://www.mmobomb.com/api
Games & Comics,mod.io,Cross Platform Mod API,`apiKey`,Yes,Unknown,https://docs.mod.io
Games & Comics,Mojang,Mojang / Minecraft API,`apiKey`,Yes,Unknown,https://wiki.vg/Mojang_API
Games & Comics,Monster Hunter World,Monster Hunter World data,No,Yes,Yes,https://docs.mhw-db.com/
Games & Comics,Open Trivia,Trivia Questions,No,Yes,Unknown,https://opentdb.com/api_config.php
Games & Comics,PandaScore,E-sports games and results,`apiKey`,Yes,Unknown,https://developers.pandascore.co/
Games & Comics,Path of Exile,Path of Exile Game Information,`OAuth`,Yes,Unknown,https://www.pathofexile.com/developer/docs
Games & Comics,PlayerDB,"Query Minecraft, Steam and XBox Accounts",No,Yes,Unknown,https://playerdb.co/
Games & Comics,Pokéapi,Pokémon Information,No,Yes,Unknown,https://pokeapi.co
Games & Comics,PokéAPI (GraphQL),The Unofficial GraphQL for PokeAPI,No,Yes,Yes,https://github.com/mazipan/graphql-pokeapi
Games & Comics,Pokémon TCG,Pokémon TCG Information,No,Yes,Unknown,https://pokemontcg.io
Games & Comics,Psychonauts,Psychonauts World Characters Information and PSI Powers,No,Yes,Yes,https://psychonauts-api.netlify.app/
Games & Comics,PUBG,Access in-game PUBG data,`apiKey`,Yes,Yes,https://developer.pubg.com/
Games & Comics,Puyo Nexus,Puyo Puyo information from Puyo Nexus Wiki,No,Yes,Yes,https://github.com/deltadex7/puyodb-api-deno
Games & Comics,quizapi.io,Access to various kind of quiz questions,`apiKey`,Yes,Yes,https://quizapi.io/
Games & Comics,Raider,Provides detailed character and guild rankings for Raiding and Mythic+ content in World of Warcraft,No,Yes,Unknown,https://raider.io/api
Games & Comics,RAWG.io,"500,000+ games for 50 platforms including mobiles",`apiKey`,Yes,Unknown,https://rawg.io/apidocs
Games & Comics,Rick and Morty,"All the Rick and Morty information, including images",No,Yes,Yes,https://rickandmortyapi.com
Games & Comics,Riot Games,League of Legends Game Information,`apiKey`,Yes,Unknown,https://developer.riotgames.com/
Games & Comics,RPS 101,"Rock, Paper, Scissors with 101 objects",No,Yes,Yes,https://rps101.pythonanywhere.com/api
Games & Comics,RuneScape,RuneScape and OSRS RPGs information,No,Yes,No,https://runescape.wiki/w/Application_programming_interface
Games & Comics,Sakura CardCaptor,Sakura CardCaptor Cards Information,No,Yes,Unknown,https://github.com/JessVel/sakura-card-captor-api
Games & Comics,Scryfall,Magic: The Gathering database,No,Yes,Yes,https://scryfall.com/docs/api
Games & Comics,SpaceTradersAPI,A playable inter-galactic space trading MMOAPI,`OAuth`,Yes,Yes,https://spacetraders.io?rel=pub-apis
