category,api,description,auth,https,cors,link
Animals,AdoptAPet,Resource to help get pets adopted,`apiKey`,Yes,Yes,https://www.adoptapet.com/public/apis/pet_list.html
Animals,Axolotl,Collection of axolotl pictures and facts,No,Yes,No,https://theaxolotlapi.netlify.app/
Animals,Cat Facts,Daily cat facts,No,Yes,No,https://alexwohlbruck.github.io/cat-facts/
Animals,Cataas,Cat as a service (cats pictures and gifs),No,Yes,No,https://cataas.com/
Animals,Cats,Pictures of cats from Tumblr,`apiKey`,Yes,No,https://docs.thecatapi.com/
Animals,Dog Facts,Random dog facts,No,Yes,Yes,https://dukengn.github.io/Dog-facts-API/
Animals,Dog Facts,Random facts of Dogs,No,Yes,Yes,https://kinduff.github.io/dog-api/
Animals,Dogs,Based on the Stanford Dogs Dataset,No,Yes,Yes,https://dog.ceo/dog-api/
Animals,eBird,Retrieve recent or notable birding observations within a region,`apiKey`,Yes,No,https://documenter.getpostman.com/view/664302/S1ENwy59
Animals,FishWatch,Information and pictures about individual fish species,No,Yes,Yes,https://www.fishwatch.gov/developers
Animals,HTTP Cat,Cat for every HTTP Status,No,Yes,Yes,https://http.cat/
Animals,HTTP Dog,Dogs for every HTTP response status code,No,Yes,Yes,https://http.dog/
Animals,IUCN,IUCN Red List of Threatened Species,`apiKey`,No,No,http://apiv3.iucnredlist.org/api/v3/docs
Animals,MeowFacts,Get random cat facts,No,Yes,No,https://github.com/wh-iterabb-it/meowfacts
Animals,Movebank,Movement and Migration data of animals,No,Yes,Yes,https://github.com/movebank/movebank-api-doc
Animals,Petfinder,"Petfinder is dedicated to helping pets find homes, another resource to get pets adopted",`apiKey`,Yes,Yes,https://www.petfinder.com/developers/
Animals,PlaceBear,Placeholder bear pictures,No,Yes,Yes,https://placebear.com/
Animals,PlaceDog,Placeholder Dog pictures,No,Yes,Yes,https://place.dog
Animals,PlaceKitten,Placeholder Kitten pictures,No,Yes,Yes,https://placekitten.com/
Animals,RandomDog,Random pictures of dogs,No,Yes,Yes,https://random.dog/woof.json
Animals,RandomDuck,Random pictures of ducks,No,Yes,No,https://random-d.uk/api
Animals,RandomFox,Random pictures of foxes,No,Yes,No,https://randomfox.ca/floof/
Animals,RescueGroups,Adoption,No,Yes,Unknown,https://userguide.rescuegroups.org/display/APIDG/API+Developers+Guide+Home
Animals,Shibe.Online,"Random pictures of Shiba Inu, cats or birds",No,Yes,Yes,http://shibe.online/
Animals,The Dog,"A public service all about Dogs, free to use when making your fancy new App, Website or Service",`apiKey`,Yes,No,https://thedogapi.com/
Animals,xeno-canto,Bird recordings,No,Yes,Unknown,https://xeno-canto.org/explore/api
Animals,Zoo Animals,Facts and pictures of zoo animals,No,Yes,Yes,https://zoo-animal-api.herokuapp.com/
Anime,AniAPI,"Anime discovery, streaming & syncing with trackers",`OAuth`,Yes,Yes,https://aniapi.com/docs/
Anime,AniDB,Anime Database,`apiKey`,No,Unknown,https://wiki.anidb.net/HTTP_API_Definition
Anime,AniList,Anime discovery & tracking,`OAuth`,Yes,Unknown,https://github.com/AniList/ApiV2-GraphQL-Docs
Anime,AnimeChan,Anime quotes (over 10k+),No,Yes,No,https://github.com/RocktimSaikia/anime-chan
Anime,AnimeFacts,Anime Facts (over 100+),No,Yes,Yes,https://chandan-02.github.io/anime-facts-rest-api/
Anime,AnimeNewsNetwork,Anime industry news,No,Yes,Yes,https://www.animenewsnetwork.com/encyclopedia/api.php
Anime,Catboy,"Neko images, funny GIFs & more",No,Yes,Yes,https://catboys.com/api
Anime,Danbooru Anime,Thousands of anime artist database to find good anime art,`apiKey`,Yes,Yes,https://danbooru.donmai.us/wiki_pages/help:api
Anime,Jikan,Unofficial MyAnimeList API,No,Yes,Yes,https://jikan.moe
Anime,Kitsu,Anime discovery platform,`OAuth`,Yes,Yes,https://kitsu.docs.apiary.io/
Anime,MangaDex,Manga Database and Community,`apiKey`,Yes,Unknown,https://api.mangadex.org/docs.html
Anime,Mangapi,Translate manga pages from one language to another,`apiKey`,Yes,Unknown,https://rapidapi.com/pierre.carcellermeunier/api/mangapi3/
Anime,MyAnimeList,Anime and Manga Database and Community,`OAuth`,Yes,Unknown,https://myanimelist.net/clubs.php?cid=13727
Anime,NekosBest,Neko Images & Anime roleplaying GIFs,No,Yes,Yes,https://docs.nekos.best
Anime,Shikimori,"Anime discovery, tracking, forum, rates",`OAuth`,Yes,Unknown,https://shikimori.one/api/doc
Anime,Studio Ghibli,Resources from Studio Ghibli films,No,Yes,Yes,https://ghibliapi.herokuapp.com
Anime,Trace Moe,A useful tool to get the exact scene of an anime from a screenshot,No,Yes,No,https://soruly.github.io/trace.moe-api/#/
Anime,Waifu.im,Get waifu pictures from an archive of over 4000 images and multiple tags,No,Yes,Yes,https://waifu.im/docs
Anime,Waifu.pics,Image sharing platform for anime images,No,Yes,No,https://waifu.pics/docs
Anti-Malware,AbuseIPDB,IP/domain/URL reputation,`apiKey`,Yes,Unknown,https://docs.abuseipdb.com/
Anti-Malware,AlienVault Open Threat Exchange (OTX),IP/domain/URL reputation,`apiKey`,Yes,Unknown,https://otx.alienvault.com/api
Anti-Malware,CAPEsandbox,Malware execution and analysis,`apiKey`,Yes,Unknown,https://capev2.readthedocs.io/en/latest/usage/api.html
Anti-Malware,Google Safe Browsing,Google Link/Domain Flagging,`apiKey`,Yes,Unknown,https://developers.google.com/safe-browsing/
Anti-Malware,MalDatabase,Provide malware datasets and threat intelligence feeds,`apiKey`,Yes,Unknown,https://maldatabase.com/api-doc.html
Anti-Malware,MalShare,Malware Archive / file sourcing,`apiKey`,Yes,No,https://malshare.com/doc.php
Anti-Malware,MalwareBazaar,Collect and share malware samples,`apiKey`,Yes,Unknown,https://bazaar.abuse.ch/api/
Anti-Malware,Metacert,Metacert Link Flagging,`apiKey`,Yes,Unknown,https://metacert.com/
Anti-Malware,NoPhishy,Check links to see if they're known phishing attempts,`apiKey`,Yes,Yes,https://rapidapi.com/Amiichu/api/exerra-phishing-check/
Anti-Malware,Phisherman,IP/domain/URL reputation,`apiKey`,Yes,Unknown,https://phisherman.gg/
Anti-Malware,Scanii,Simple REST API that can scan submitted documents/files for the presence of threats,`apiKey`,Yes,Yes,https://docs.scanii.com/
Anti-Malware,URLhaus,Bulk queries and Download Malware Samples,No,Yes,Yes,https://urlhaus-api.abuse.ch/
Anti-Malware,URLScan.io,Scan and Analyse URLs,`apiKey`,Yes,Unknown,https://urlscan.io/about-api/
Anti-Malware,VirusTotal,VirusTotal File/URL Analysis,`apiKey`,Yes,Unknown,https://www.virustotal.com/en/documentation/public-api/
Anti-Malware,Web of Trust,IP/domain/URL reputation,`apiKey`,Yes,Unknown,https://support.mywot.com/hc/en-us/sections/360004477734-API-
Art & Design,Améthyste,Generate images for Discord users,`apiKey`,Yes,Unknown,https://api.amethyste.moe/
Art & Design,Art Institute of Chicago,Art,No,Yes,Yes,https://api.artic.edu/docs/
Art & Design,Colormind,Color scheme generator,No,No,Unknown,http://colormind.io/api-access/
Art & Design,ColourLovers,"Get various patterns, palettes and images",No,No,Unknown,http://www.colourlovers.com/api
Art & Design,Cooper Hewitt,Smithsonian Design Museum,`apiKey`,Yes,Unknown,https://collection.cooperhewitt.org/api
Art & Design,Dribbble,Discover the world’s top designers & creatives,`OAuth`,Yes,Unknown,https://developer.dribbble.com
Art & Design,EmojiHub,Get emojis by categories and groups,No,Yes,Yes,https://github.com/cheatsnake/emojihub
Art & Design,Europeana,European Museum and Galleries content,`apiKey`,Yes,Unknown,https://pro.europeana.eu/resources/apis/search
Art & Design,Harvard Art Museums,Art,`apiKey`,No,Unknown,https://github.com/harvardartmuseums/api-docs
Art & Design,Icon Horse,"Favicons for any website, with fallbacks",No,Yes,Yes,https://icon.horse
Art & Design,Iconfinder,Icons,`apiKey`,Yes,Unknown,https://developer.iconfinder.com
Art & Design,Icons8,"Icons (find ""search icon"" hyperlink in page)",No,Yes,Unknown,https://img.icons8.com/
Art & Design,Lordicon,Icons with predone Animations,No,Yes,Yes,https://lordicon.com/
Art & Design,Metropolitan Museum of Art,Met Museum of Art,No,Yes,No,https://metmuseum.github.io/
Art & Design,Noun Project,Icons,`OAuth`,No,Unknown,http://api.thenounproject.com/index.html
Art & Design,PHP-Noise,Noise Background Image Generator,No,Yes,Yes,https://php-noise.com/
Art & Design,Pixel Encounter,SVG Icon Generator,No,Yes,No,https://pixelencounter.com/api
Art & Design,Rijksmuseum,RijksMuseum Data,`apiKey`,Yes,Unknown,https://data.rijksmuseum.nl/object-metadata/api/
Art & Design,Word Cloud,Easily create word clouds,`apiKey`,Yes,Unknown,https://wordcloudapi.com/
Art & Design,xColors,Generate & convert colors,No,Yes,Yes,https://x-colors.herokuapp.com/
Authentication & Authorization,Auth0,"Easy to implement, adaptable authentication and authorization platform",`apiKey`,Yes,Yes,https://auth0.com
Authentication & Authorization,GetOTP,Implement OTP flow quickly,`apiKey`,Yes,No,https://otp.dev/en/docs/
Authentication & Authorization,Micro User Service,User management and authentication,`apiKey`,Yes,No,https://m3o.com/user
Authentication & Authorization,MojoAuth,Secure and modern passwordless authentication platform,`apiKey`,Yes,Yes,https://mojoauth.com
Authentication & Authorization,SAWO Labs,Simplify login and improve user experience by integrating passwordless authentication in your app,`apiKey`,Yes,Yes,https://sawolabs.com
Authentication & Authorization,Stytch,User infrastructure for modern applications,`apiKey`,Yes,No,https://stytch.com/
Authentication & Authorization,Warrant,APIs for authorization and access control,`apiKey`,Yes,Yes,https://warrant.dev/
Blockchain,Bitquery,Onchain GraphQL APIs & DEX APIs,`apiKey`,Yes,Yes,https://graphql.bitquery.io/ide
Blockchain,Chainlink,Build hybrid smart contracts with Chainlink,No,Yes,Unknown,https://chain.link/developer-resources
Blockchain,Chainpoint,Chainpoint is a global network for anchoring data to the Bitcoin blockchain,No,Yes,Unknown,https://tierion.com/chainpoint/
Blockchain,Covalent,Multi-blockchain data aggregator platform,`apiKey`,Yes,Unknown,https://www.covalenthq.com/docs/api/
Blockchain,Etherscan,Ethereum explorer API,`apiKey`,Yes,Yes,https://etherscan.io/apis
Blockchain,Helium,"Helium is a global, distributed network of Hotspots that create public, long-range wireless coverage",No,Yes,Unknown,https://docs.helium.com/api/blockchain/introduction/
Blockchain,Nownodes,Blockchain-as-a-service solution that provides high-quality connection via API,`apiKey`,Yes,Unknown,https://nownodes.io/
Blockchain,Steem,Blockchain-based blogging and social media website,No,No,No,https://developers.steem.io/
Blockchain,The Graph,Indexing protocol for querying networks like Ethereum with GraphQL,`apiKey`,Yes,Unknown,https://thegraph.com
Blockchain,Walltime,To retrieve Walltime's market info,No,Yes,Unknown,https://walltime.info/api.html
Blockchain,Watchdata,Provide simple and reliable API access to Ethereum blockchain,`apiKey`,Yes,Unknown,https://docs.watchdata.io
Books,A Bíblia Digital,Do not worry about managing the multiple versions of the Bible,`apiKey`,Yes,No,https://www.abibliadigital.com.br/en
Books,Bhagavad Gita,Open Source Shrimad Bhagavad Gita API including 21+ authors translation in Sanskrit/English/Hindi,`apiKey`,Yes,Yes,https://docs.bhagavadgitaapi.in
Books,Bhagavad Gita,Bhagavad Gita text,`OAuth`,Yes,Yes,https://bhagavadgita.io/api
Books,Bhagavad Gita telugu,Bhagavad Gita API in telugu and odia languages,No,Yes,Yes,https://gita-api.vercel.app
Books,Bible-api,Free Bible API with multiple languages,No,Yes,Yes,https://bible-api.com/
Books,British National Bibliography,Books,No,No,Unknown,http://bnb.data.bl.uk/
Books,Crossref Metadata Search,Books & Articles Metadata,No,Yes,Unknown,https://github.com/CrossRef/rest-api-doc
Books,Ganjoor,"Classic Persian poetry works including access to related manuscripts, recitations and music tracks",`OAuth`,Yes,Yes,https://api.ganjoor.net
Books,Google Books,Books,`OAuth`,Yes,Unknown,https://developers.google.com/books/
Books,GurbaniNow,Fast and Accurate Gurbani RESTful API,No,Yes,Unknown,https://github.com/GurbaniNow/api
Books,Gutendex,Web-API for fetching data from Project Gutenberg Books Library,No,Yes,Unknown,https://gutendex.com/
Books,Open Library,"Books, book covers and related data",No,Yes,No,https://openlibrary.org/developers/api
Books,Penguin Publishing,"Books, book covers and related data",No,Yes,Yes,http://www.penguinrandomhouse.biz/webservices/rest/
Books,PoetryDB,Enables you to get instant data from our vast poetry collection,No,Yes,Yes,https://github.com/thundercomb/poetrydb#readme
Books,Quran,RESTful Quran API with multiple languages,No,Yes,Yes,https://quran.api-docs.io/
Books,Quran Cloud,"A RESTful Quran API to retrieve an Ayah, Surah, Juz or the entire Holy Quran",No,Yes,Yes,https://alquran.cloud/api
Books,Quran-api,Free Quran API Service with 90+ different languages and 400+ translations,No,Yes,Yes,https://github.com/fawazahmed0/quran-api#readme
Books,Rig Veda,"Gods and poets, their categories, and the verse meters, with the mandal and sukta number",No,Yes,Unknown,https://aninditabasu.github.io/indica/html/rv.html
Books,The Bible,Everything you need from the Bible in one discoverable place,`apiKey`,Yes,Unknown,https://docs.api.bible
Books,Thirukkural,1330 Thirukkural poems and explanation in Tamil and English,No,Yes,Yes,https://api-thirukkural.web.app/
Books,Vedic Society,"Descriptions of all nouns (names, places, animals, things) from vedic literature",No,Yes,Unknown,https://aninditabasu.github.io/indica/html/vs.html
Books,Wizard World,Get information from the Harry Potter universe,No,Yes,Yes,https://wizard-world-api.herokuapp.com/swagger/index.html
Books,Wolne Lektury,API for obtaining information about e-books available on the WolneLektury.pl website,No,Yes,Unknown,https://wolnelektury.pl/api/
Business,Apache Superset,API to manage your BI dashboards and data sources on Superset,`apiKey`,Yes,Yes,https://superset.apache.org/docs/api
Business,Charity Search,Non-profit charity data,`apiKey`,No,Unknown,http://charityapi.orghunter.com/
Business,Clearbit Logo,Search for company logos and embed them in your projects,`apiKey`,Yes,Unknown,https://clearbit.com/docs#logo-api
Business,Domainsdb.info,Registered Domain Names Search,No,Yes,No,https://domainsdb.info/
Business,Freelancer,Hire freelancers to get work done,`OAuth`,Yes,Unknown,https://developers.freelancer.com
Business,Gmail,"Flexible, RESTful access to the user's inbox",`OAuth`,Yes,Unknown,https://developers.google.com/gmail/api/
Business,Google Analytics,"Collect, configure and analyze your data to reach the right audience",`OAuth`,Yes,Unknown,https://developers.google.com/analytics/
Business,Instatus,Post to and update maintenance and incidents on your status page through an HTTP REST API,`apiKey`,Yes,Unknown,https://instatus.com/help/api
Business,Mailchimp,Send marketing campaigns and transactional mails,`apiKey`,Yes,Unknown,https://mailchimp.com/developer/
Business,mailjet,Marketing email can be sent and mail templates made in MJML or HTML can be sent using API,`apiKey`,Yes,Unknown,https://www.mailjet.com/
Business,markerapi,Trademark Search,No,No,Unknown,https://markerapi.com
Business,ORB Intelligence,Company lookup,`apiKey`,Yes,Unknown,https://api.orb-intelligence.com/docs/
Business,Redash,Access your queries and dashboards on Redash,`apiKey`,Yes,Yes,https://redash.io/help/user-guide/integrations-and-api/api
Business,Smartsheet,Allows you to programmatically access and Smartsheet data and account information,`OAuth`,Yes,No,https://smartsheet.redoc.ly/
Business,Square,"Easy way to take payments, manage refunds, and help customers checkout online",`OAuth`,Yes,Unknown,https://developer.squareup.com/reference/square
Business,SwiftKanban,"Kanban software, Visualize Work, Increase Organizations Lead Time, Throughput & Productivity",`apiKey`,Yes,Unknown,https://www.digite.com/knowledge-base/swiftkanban/article/api-for-swift-kanban-web-services/#restapi
Business,Tenders in Hungary,Get data for procurements in Hungary in JSON format,No,Yes,Unknown,https://tenders.guru/hu/api
Business,Tenders in Poland,Get data for procurements in Poland in JSON format,No,Yes,Unknown,https://tenders.guru/pl/api
Business,Tenders in Romania,Get data for procurements in Romania in JSON format,No,Yes,Unknown,https://tenders.guru/ro/api
Business,Tenders in Spain,Get data for procurements in Spain in JSON format,No,Yes,Unknown,https://tenders.guru/es/api
Business,Tenders in Ukraine,Get data for procurements in Ukraine in JSON format,No,Yes,Unknown,https://tenders.guru/ua/api
Business,Tomba email finder,Email Finder for B2B sales and email marketing and email verifier,`apiKey`,Yes,Yes,https://tomba.io/api
Business,Trello,"Boards, lists and cards to help you organize and prioritize your projects",`OAuth`,Yes,Unknown,https://developers.trello.com/
Calendar,Abstract Public Holidays,"Data on national, regional, and religious holidays via API",`apiKey`,Yes,Yes,https://www.abstractapi.com/holidays-api
Calendar,Calendarific,Worldwide Holidays,`apiKey`,Yes,Unknown,https://calendarific.com/
Calendar,Checkiday - National Holiday API,"Industry-leading Holiday API. Over 5,000 holidays and thousands of descriptions. Trusted by the World’s leading companies",`apiKey`,Yes,Unknown,https://apilayer.com/marketplace/checkiday-api
Calendar,Church Calendar,Catholic liturgical calendar,No,No,Unknown,http://calapi.inadiutorium.cz/
Calendar,Czech Namedays Calendar,Lookup for a name and returns nameday date,No,No,Unknown,https://svatky.adresa.info
Calendar,Festivo Public Holidays,Fastest and most advanced public holiday and observance service on the market,`apiKey`,Yes,Yes,https://docs.getfestivo.com/docs/products/public-holidays-api/intro
Calendar,Google Calendar,"Display, create and modify Google calendar events",`OAuth`,Yes,Unknown,https://developers.google.com/google-apps/calendar/
Calendar,Hebrew Calendar,"Convert between Gregorian and Hebrew, fetch Shabbat and Holiday times, etc",No,No,Unknown,https://www.hebcal.com/home/developer-apis
Calendar,Holidays,Historical data regarding holidays,`apiKey`,Yes,Unknown,https://holidayapi.com/
Calendar,LectServe,Protestant liturgical calendar,No,No,Unknown,http://www.lectserve.com
Calendar,Nager.Date,Public holidays for more than 90 countries,No,Yes,No,https://date.nager.at
Calendar,Namedays Calendar,Provides namedays for multiple countries,No,Yes,Yes,https://nameday.abalin.net
Calendar,Non-Working Days,Database of ICS files for non working days,No,Yes,Unknown,https://github.com/gadael/icsdb
Calendar,Non-Working Days,"Simple REST API for checking working, non-working or short days for Russia, CIS, USA and other",No,Yes,Yes,https://isdayoff.ru
Calendar,Russian Calendar,Check if a date is a Russian holiday or not,No,Yes,No,https://github.com/egno/work-calendar
Calendar,UK Bank Holidays,"Bank holidays in England and Wales, Scotland and Northern Ireland",No,Yes,Unknown,https://www.gov.uk/bank-holidays.json
Cloud Storage & File Sharing,AnonFiles,Upload and share your files anonymously,No,Yes,Unknown,https://anonfiles.com/docs/api
Cloud Storage & File Sharing,BayFiles,Upload and share your files,No,Yes,Unknown,https://bayfiles.com/docs/api
Cloud Storage & File Sharing,Box,File Sharing and Storage,`OAuth`,Yes,Unknown,https://developer.box.com/
Cloud Storage & File Sharing,ddownload,File Sharing and Storage,`apiKey`,Yes,Unknown,https://ddownload.com/api
Cloud Storage & File Sharing,Dropbox,File Sharing and Storage,`OAuth`,Yes,Unknown,https://www.dropbox.com/developers
Cloud Storage & File Sharing,File.io,"Super simple file sharing, convenient, anonymous and secure",No,Yes,Unknown,https://www.file.io
Cloud Storage & File Sharing,Filestack,Filestack File Uploader & File Upload API,`apiKey`,Yes,Unknown,https://www.filestack.com
Cloud Storage & File Sharing,GoFile,Unlimited size file uploads for free,`apiKey`,Yes,Unknown,https://gofile.io/api
Cloud Storage & File Sharing,Google Drive,File Sharing and Storage,`OAuth`,Yes,Unknown,https://developers.google.com/drive/
Cloud Storage & File Sharing,Gyazo,Save & Share screen captures instantly,`apiKey`,Yes,Unknown,https://gyazo.com/api/docs
Cloud Storage & File Sharing,Imgbb,Simple and quick private image sharing,`apiKey`,Yes,Unknown,https://api.imgbb.com/
Cloud Storage & File Sharing,OneDrive,File Sharing and Storage,`OAuth`,Yes,Unknown,https://developer.microsoft.com/onedrive
Cloud Storage & File Sharing,Pantry,Free JSON storage for small projects,No,Yes,Yes,https://getpantry.cloud/
Cloud Storage & File Sharing,Pastebin,Plain Text Storage,`apiKey`,Yes,Unknown,https://pastebin.com/doc_api
Cloud Storage & File Sharing,Pinata,IPFS Pinning Services API,`apiKey`,Yes,Unknown,https://docs.pinata.cloud/
Cloud Storage & File Sharing,Quip,File Sharing and Storage for groups,`apiKey`,Yes,Yes,https://quip.com/dev/automation/documentation
Cloud Storage & File Sharing,Storj,Decentralized Open-Source Cloud Storage,`apiKey`,Yes,Unknown,https://docs.storj.io/dcs/
Cloud Storage & File Sharing,The Null Pointer,No-bullshit file hosting and URL shortening service,No,Yes,Unknown,https://0x0.st
Cloud Storage & File Sharing,Web3 Storage,File Sharing and Storage for Free with 1TB Space,`apiKey`,Yes,Yes,https://web3.storage/
Continuous Integration,Azure DevOps Health,Resource health helps you diagnose and get support when an Azure issue impacts your resources,`apiKey`,No,No,https://docs.microsoft.com/en-us/rest/api/resourcehealth
Continuous Integration,Bitrise,Build tool and processes integrations to create efficient development pipelines,`apiKey`,Yes,Unknown,https://api-docs.bitrise.io/
Continuous Integration,Buddy,The fastest continuous integration and continuous delivery platform,`OAuth`,Yes,Unknown,https://buddy.works/docs/api/getting-started/overview
Continuous Integration,CircleCI,Automate the software development process using continuous integration and continuous delivery,`apiKey`,Yes,Unknown,https://circleci.com/docs/api/v1-reference/
Continuous Integration,Codeship,Codeship is a Continuous Integration Platform in the cloud,`apiKey`,Yes,Unknown,https://docs.cloudbees.com/docs/cloudbees-codeship/latest/api-overview/
Continuous Integration,Travis CI,Sync your GitHub projects with Travis CI to test your code in minutes,`apiKey`,Yes,Unknown,https://docs.travis-ci.com/api/
Cryptocurrency,0x,API for querying token and pool stats across various liquidity pools,No,Yes,Yes,https://0x.org/api
Cryptocurrency,1inch,API for querying decentralize exchange,No,Yes,Unknown,https://1inch.io/api/
Cryptocurrency,Alchemy Ethereum,Ethereum Node-as-a-Service Provider,`apiKey`,Yes,Yes,https://docs.alchemy.com/alchemy/
Cryptocurrency,apilayer coinlayer,Real-time Crypto Currency Exchange Rates,`apiKey`,Yes,Unknown,https://coinlayer.com
Cryptocurrency,Binance,Exchange for Trading Cryptocurrencies based in China,`apiKey`,Yes,Unknown,https://github.com/binance/binance-spot-api-docs
Cryptocurrency,Bitcambio,Get the list of all traded assets in the exchange,No,Yes,Unknown,https://nova.bitcambio.com.br/api/v3/docs#a-public
Cryptocurrency,BitcoinAverage,Digital Asset Price Data for the blockchain industry,`apiKey`,Yes,Unknown,https://apiv2.bitcoinaverage.com/
Cryptocurrency,BitcoinCharts,Financial and Technical Data related to the Bitcoin Network,No,Yes,Unknown,https://bitcoincharts.com/about/exchanges/
Cryptocurrency,Bitfinex,Cryptocurrency Trading Platform,`apiKey`,Yes,Unknown,https://docs.bitfinex.com/docs
Cryptocurrency,Bitmex,Real-Time Cryptocurrency derivatives trading platform based in Hong Kong,`apiKey`,Yes,Unknown,https://www.bitmex.com/app/apiOverview
Cryptocurrency,Bittrex,Next Generation Crypto Trading Platform,`apiKey`,Yes,Unknown,https://bittrex.github.io/api/v3
Cryptocurrency,Block,"Bitcoin Payment, Wallet & Transaction Data",`apiKey`,Yes,Unknown,https://block.io/docs/basic
Cryptocurrency,Blockchain,"Bitcoin Payment, Wallet & Transaction Data",`apiKey`,Yes,Unknown,https://www.blockchain.com/api
Cryptocurrency,blockfrost Cardano,Interaction with the Cardano mainnet and several testnets,`apiKey`,Yes,Unknown,https://blockfrost.io/
Cryptocurrency,Brave NewCoin,Real-time and historic crypto data from more than 200+ exchanges,`apiKey`,Yes,Unknown,https://bravenewcoin.com/developers
Cryptocurrency,BtcTurk,"Real-time cryptocurrency data, graphs and API that allows buy&sell",`apiKey`,Yes,Yes,https://docs.btcturk.com/
Cryptocurrency,Bybit,Cryptocurrency data feed and algorithmic trading,`apiKey`,Yes,Unknown,https://bybit-exchange.github.io/docs/linear/#t-introduction
Cryptocurrency,CoinAPI,All Currency Exchanges integrate under a single api,`apiKey`,Yes,No,https://docs.coinapi.io/
Cryptocurrency,Coinbase,"Bitcoin, Bitcoin Cash, Litecoin and Ethereum Prices",`apiKey`,Yes,Unknown,https://developers.coinbase.com
Cryptocurrency,Coinbase Pro,Cryptocurrency Trading Platform,`apiKey`,Yes,Unknown,https://docs.pro.coinbase.com/#api
Cryptocurrency,CoinCap,Real time Cryptocurrency prices through a RESTful API,No,Yes,Unknown,https://docs.coincap.io/
Cryptocurrency,CoinDCX,Cryptocurrency Trading Platform,`apiKey`,Yes,Unknown,https://docs.coindcx.com/
Cryptocurrency,CoinDesk,CoinDesk's Bitcoin Price Index (BPI) in multiple currencies,No,Yes,Unknown,https://old.coindesk.com/coindesk-api/
Cryptocurrency,CoinGecko,"Cryptocurrency Price, Market, and Developer/Social Data",No,Yes,Yes,http://www.coingecko.com/api
Cryptocurrency,Coinigy,Interacting with Coinigy Accounts and Exchange Directly,`apiKey`,Yes,Unknown,https://coinigy.docs.apiary.io
Cryptocurrency,Coinlib,Crypto Currency Prices,`apiKey`,Yes,Unknown,https://coinlib.io/apidocs
Cryptocurrency,Coinlore,"Cryptocurrencies prices, volume and more",No,Yes,Unknown,https://www.coinlore.com/cryptocurrency-data-api
Cryptocurrency,CoinMarketCap,Cryptocurrencies Prices,`apiKey`,Yes,Unknown,https://coinmarketcap.com/api/
Cryptocurrency,Coinpaprika,"Cryptocurrencies prices, volume and more",No,Yes,Yes,https://api.coinpaprika.com
